20201117 오전 9:09,101,261,이번엔 GS리테일KT 동맹…디지털 물류 혁신 힘 모은다,GS리테일 KT AI 기술 활용한 물류 운송 효율화 시스템 도입향후 미래형 물류 서비스 및 EV 기반 모빌리티 사업 공동 추진 예정GS리테일과 KT가 손을 잡았다. 디지털 물류 혁신을 위해 힘을 모으기로 한 것이다. GS리테일 007070 과 KT 030200 는 17일 서울 역삼동 GS타워에서 디지털 물류 사업 협력을 위한 업무 협약 을 체결한다. 양사는 이번 협약으로 GS리테일이 보유한 온·오프라인 물류 데이터와 KT의 인공지능 AI 물류 최적화 플랫폼을 결합한 물류운송 최적화 시범 사업을 추진한다. AI 빅데이터 IT 플랫폼 등을 활용해 물류 데이터를 분석하고 최적화된 운송 환경을 구현하는 디지털물류 공동 사업에 나설 방침이다. 향후에는 물류와 모빌리티를 융합한 미래형 서비스 개발과 친환경 물류 시장 선도를 위한 EV 전기차 기반 모빌리티 사업도 공동 추진할 계획이다.GS리테일과 KT는 내달부터 약 2개월간 GS리테일 고양물류센터와 제주물류센터를 대상으로 KT AI 물류최적화 플랫폼을 활용한 물류운송 효율화 시스템 을 구축한다. 이번 시범사업으로 GS리테일은 KT의 AI 기술을 활용해 최적의 운송 경로와 운행 일정을 자동 수립해주는 물류 최적화 서비스 를 도입한다. 이 서비스는 KT AI 물류 최적화 플랫폼과 연동된 전용 내비게이션을 GS리테일의 배송매니저 애플리케이션 통해 제공된다.AI 물류최적화 플랫폼은 기존의 운송 데이터와 실시간 교통상황 TPEG 등 네비게이션 기술에 화물량 및 영업점별 인수시간 등 복합적 변수를 AI가 분석해 경로를 안내한다. 여기에 화물차의 높이 길이 무게와 좁은 길 유턴 회피 옵션 등 외부 환경까지 반영한 경로를 안내한다.양사는 이처럼 자사가 보유한 핵심 역량과 혁신 기술을 바탕으로 데이터 연계 분석을 진행해 빅데이터 기반 스마트 디지털 물류 환경을 구현하겠다는 목표를 세웠다.GS리테일은 전국 1만5000여개에 달하는 오프라인 점포망과 온라인 커머스를 기반으로 차별화된 운영 노하우를 보유하고 있다. 편의점 업계 최초 TMS Transport Management System 도입과 비대면 드론 배송서비스 무인 스마트편의점 운영 등 IT와 물류 인프라를 통해 하루 700만건 이상의 데이터를 축적하며 유통 물류 기술혁신 사업자로서 디지털 전환을 추진하고 있다. KT는 170만 대 차량에 회선·관제 서비스를 제공하는 모빌리티 회선·관제 분야의 1위 사업자다. 지난 십 수 년간 축적한 모빌리티 기술과 운용 노하우 운송 데이터 융합·분석 기술을 바탕으로 AI 물류최적화 플랫폼 을 개발했다.허연수 GS리테일 대표이사 부회장은 빠르게 변화하는 유통환경과 산업구조 속에서 국내 다양한 산업의 혁신을 리딩해 온 KT와 함께 국내 디지털물류 혁신과 고도화를 이끌어 내기 위한 첫 걸음을 떼고자 한다 며 양사가 지닌 역량과 인프라 기술력을 바탕으로 상호 협력적인 관계를 발전시키고 차별화된 신 성장사업 개발과 더불어 새로운 비즈니스 기회를 발굴할 수 있길 기대한다 고 말했다.구현모 KT 대표는 국내 최고 수준의 AI 기술을 보유한 KT와 대한민국 대표 유통회사인 GS리테일의 사업협력은 국내 물류 분야 디지털 혁신을 주도하는 큰 바람이 될 것 이라며 양사의 협력 시너지를 통해 디지털물류라는 새로운 혁신 모델을 창출하고 향후 다양한 산업으로 디지털 혁신을 확대해 나가겠다 고 말했다.,https://news.naver.com/main/read.nhn?mode=LS2D&mid=shm&sid1=101&sid2=261&oid=366&aid=0000620452
20201117 오전 9:03,101,261,AI로 디지털 물류 최적화…GS리테일 KT 손잡는다,다음 달 2개 물류센터 시범 사업AI 활용해 물류·운송 최적화 구현친환경 물류 모빌리티 사업 추진 서울 뉴시스 손정빈 기자 지에스 GS 리테일이 KT와 손잡고 디지털 물류 시스템 구축에 나선다. GS리테일은 17일 인공지능 AI 빅데이터 IT 플랫폼 등을 활용해 물류 데이터를 융합·분석하고 최적화된 물류·운송 환경을 구현하는 디지털 물류 공동 사업을 위해 손을 잡았다 고 했다. 두 회사는 이날 오전 서울 강남구 GS타워에서 디지털 물류 사업 협력을 위한 업무 협약 을 맺었다. 이들은 향후 물류와 모빌리티를 융합한 미래형 서비스 개발과 친환경 물류 시장 선도를 위한 EV Electric Vehicle 기반 모빌리티 사업 개발도 공동 추진한다는 계획이다.GS리테일과 KT는 다음 달부터 2개월간 GS리테일 고양물류센터와 제주물류센터를 대상으로 KT AI 물류 최적화 플랫폼을 활용한 물류 운송 효율화 시스템 시범 사업을 진행한다.이번 시범 사업으로 GS리테일은 KT의 AI 기술을 활용해 최적의 운송 경로와 운행 일정을 자동 수립해주는 물류 최적화 서비스를 도입한다. 이 서비스는 KT AI 물류 최적화 플랫폼과 연동된 전용 내비게이션을 GS리테일 배송 매니저 앱으로 제공한다. AI 물류 최적화 플랫폼은 기존 운송 데이터와 실시간 교통 상황 화물량 및 영업점별 인수 시간 등 복합적 변수까지 포함해 적용되며 화물차 높이·길이·무게와 좁은 길 유턴 회피 옵션 등 외부 환경까지 반영해 최적 경로를 안내함으로써 운전 편의성을 높이고 이동 거리 단축에 도움을 준다.GS리테일과 KT는 각사 핵심 역량과 기술을 바탕으로 데이터 연계 분석을 진행함으로써 빅데이터 기반 스마트한 디지털 물류 환경을 구현하고 친환경 물류 시장을 선도하는 미래 신 新 성장동력을 발굴한다는 방침이다.앞서 GS리테일은 편의점 업계 최초 TMS Transport Management System 도입과 비대면 드론 배송 서비스 무인 스마트 편의점 운영 등 혁신적인 IT·물류 인프라를 통해 하루 700만건 이상 데이터를 축적하며 유통 물류 기술혁신 사업자로서 디지털 전환과 혁신을 지속해왔다.KT는 170만대 차량에 회선·관제 서비스를 제공하는 이 부문 1위 사업자다. 지난 십수 년간 축적한 모빌리티 기술과 운용 노하우 특히 운송 데이터 융합·분석 기술을 바탕으로 AI 물류 최적화 플랫폼을 개발했다.허연수 GS리테일 부회장은 어느 때보다 빠르게 변화하는 유통 환경과 산업 구조 속에서 국내 다양한 산업의 혁신을 리딩해 온 KT와 함께 국내 디지털물류 혁신과 고도화를 이끌어내기 위한 첫 걸음을 떼고자 한다 며 양사가 지닌 역량과 인프라 기술력을 바탕으로 상호 협력 관계를 유지·발전하며 차별화한 신 성장사업 개발과 더불어 새로운 비즈니스 기회 발굴의 초석이 되길 희망한다 고 했다.,https://news.naver.com/main/read.nhn?mode=LS2D&mid=shm&sid1=101&sid2=261&oid=003&aid=0010188813
20201117 오전 8:44,101,261,GS리테일·KT 인공지능 활용한 물류사업 공동 추진,양사 데이터와 플랫폼 활용한 물류운송 최적화물류 모빌리티 융합 및 다양한 서비스 사업개발 계획 아시아경제 임혜선 기자 GS리테일과 KT가 인공지능 AI 을 활용한 물류 사업을 공동으로 추진한다.GS리테일은 17일 서울 강남구 역삼동에 위치한 GS타워에서 KT와 ‘디지털물류 사업협력을 위한 업무협약’을 체결했다고 밝혔다.이번 협약으로 양사는 GS리테일이 보유한 온·오프라인 물류데이터와 KT AI 물류 최적화 플랫폼을 통한 물류운송 최적화 시범사업을 추진한다. AI 빅데이터 IT 플랫폼 등을 활용해 물류데이터를 융합·분석하고 최적화된 물류 및 운송환경을 구현하는 디지털물류 공동사업을 위해 손을 맞잡게 된 것이다. 우선 GS리테일과 KT는 다음달부터 약 2개월간 GS리테일 고양물류센터와 제주물류센터를 대상으로 KT AI 물류최적화 플랫폼을 활용한 ‘물류운송 효율화 시스템’ 시범사업을 진행한다. GS리테일은 KT의 AI 기술을 활용해 최적의 운송경로와 운행일정을 자동 수립해주는 ‘물류 최적화 서비스’를 도입한다. KT는 최적의 운송 경로와 운행 일정을 AI를 활용해 자동으로 수립해주는 물류 최적화 서비스 를 GS리테일에 제공한다. GS리테일의 배송 담당자는 KT 플랫폼에 연동된 상용차 전용 내비게이션과 애플리케이션을 통해 이를 활용할 수 있다.AI 물류최적화 플랫폼은 기존의 운송데이터와 실시간 교통상황 화물량 및 영업점별 인수시간 등 복합적 변수까지 포함해 적용된다. 화물차의 높이 길이 무게와 좁은 길 유턴 회피옵션 등 외부환경까지 반영한 최적의 경로를 안내함으로써 운전편의성을 높이고 이동거리 단축에도 도움을 준다.향후에는 물류와 모빌리티를 융합한 미래형 서비스개발과 친환경 물류시장 선도를 위한 EV Electric Vehicle 기반의 모빌리티 사업개발도 공동 추진해 미래 신성장 사업영역까지 협력을 다각화할 계획이다.허연수 GS리테일 대표이사 부회장은 빠르게 변화하는 유통환경과 산업구조속에서 국내 다양한 산업의 혁신을 해온 KT와 함께 국내 디지털물류 혁신과 고도화를 이끌어 내기 위한 첫 걸음을 떼고자 한다 며 양사가 지닌 역량과 인프라 기술력을 바탕으로 상호 협력적인 관계를 유지 발전시키며 차별화된 신 성장사업 개발과 더불어 새로운 비즈니스 기회 발굴의 초석이 될 것 이라고 말했다. 구현모 KT 대표는 양사간의 협력 시너지를 통해 디지털물류라는 새로운 혁신 모델을 창출하고 향후 다양한 산업으로 디지털 혁신을 확대해 나가겠다 고 밝혔다.,https://news.naver.com/main/read.nhn?mode=LS2D&mid=shm&sid1=101&sid2=261&oid=277&aid=0004793105
20201117 오전 8:26,101,261,KT GS리테일과 AI 플랫폼 통한 디지털 물류혁신 추진,GS리테일 고양·제주 운송 최적화 시범사업“디지털 전환으로 미래 혁신모델 공동 개발”서울 광화문 KT 이스트 사옥.ⓒKTKT가 GS리테일과 인공지능 AI 빅데이터 등 최첨단 정보통신기술 ICT 로 국내 물류 산업의 혁신을 주도하기 위해 협력한다.KT는 GS리테일과 ‘디지털물류 사업’을 공동 추진한다고 17일 밝혔다. 이날 양사는 서울 강남구 GS타워에서 사업협력을 위한 업무협약 MOU 을 맺었다.디지털물류는 AI 빅데이터 정보기술 IT 플랫폼 등으로 물류 데이터를 융합·분석하고 각 기업에 최적화된 물류 및 운송 환경을 구현하는 것을 말한다.KT는 최적의 운송 경로와 운행 일정을 AI 기술을 활용해 자동으로 수립해주는 ‘물류 최적화 서비스’를 제공한다. 서비스는 KT 물류 최적화 플랫폼과 연동된 상용차 전용 내비게이션과 GS리테일의 ‘배송매니저’ 애플리케이션 앱 을 통해 제공된다.KT ‘AI 물류 최적화 플랫폼’은 주요 거점의 위치 정보를 고려한 운송경로를 설계하고 화물차의 높이·길이·무게 등 세부적인 변수를 반영해 운송기사 관점에서 최적의 경로를 안내한다. 좁은 길·유턴·회피옵션 등 외부 환경을 반영해 운전의 편의성을 높이고 이동 거리 단축을 돕는다.시범사업을 통해 양사는 물류 계획 수립 단계부터 GS물류센터를 비롯해 1만5000여개의 GS 편의점 위치 화물차의 출·도착 차고지 등을 기준으로 최적의 이동 경로와 하차 장소 등의 정보를 제공한다.이 정보는 KT가 개발한 AI 예측모델을 통해 도출된다. 기존의 운송 데이터와 실시간 교통 상황 화물량 및 영업점 별 인수 가능 시간 등 복합적 변수까지 포함해 시범 사업에 적용된다.이날 구현모 KT 대표와 허연수 GS리테일 대표는 AI에 기반을 둔 운송 최적화 시범사업을 시작으로 물류 디지털 트랜스포메이션 DX 을 위한 AI·빅데이터 활용 친환경 물류 시장 선도를 목표로 EV 기반 모빌리티 협력 및 물류와 모빌리티를 융합한 미래 신성장 사업영역까지 사업협력을 본격화하기로 논의했다.구현모 대표는 “국내 최고 수준의 AI 기술을 보유한 KT와 대한민국 대표 유통회사인 GS리테일의 사업협력은 국내 물류 분야 디지털 혁신을 주도하는 큰 바람이 될 것”이라며 “양사간의 협력 시너지를 통해 코로나19 시대 사회적 이슈가 되는 물류분야의 디지털 혁신 모델을 창출할 것이며 이것이 KT가 추구하는 디지털플랫폼 기업 Digico 의 사례다”라고 강조했다허연수 대표는 “빠르게 변화하는 유통환경과 산업구조 속에서 국내 다양한 산업의 혁신을 리딩해 온 KT와 함께 디지털물류 혁신과 고도화를 이끌어 내기 위한 첫 걸음을 떼고자 한다”며 “양사가 지닌 역량과 인프라 기술력을 바탕으로 상호 협력적인 관계를 유지 발전시키며 차별화된 신 성장사업 개발과 더불어 새로운 비즈니스 기회 발굴의 초석이 되길 희망한다”고 말했다.,https://news.naver.com/main/read.nhn?mode=LS2D&mid=shm&sid1=101&sid2=261&oid=119&aid=0002443901
20201118 오후 6:00,101,261,BGF리테일 ‘증정품 보관’ 서비스 유지…GS리테일에 승소,디지털타임스 김아름 기자 BGF리테일이 GS리테일과의 증정품 보관 서비스 관련 특허 분쟁에서 승소했다. 18일 법조계 등에 따르면 대법원은 지난 5일 GS25와 CU의 특허 분쟁과 관련해 특허심판원 결정을 취소해달라는 GS리테일의 상고를 기각했다. CU의 쿠폰 키핑 서비스가 GS25의 나만의 냉장고 의 특허를 침해하지 않았다는 판단이다. 앞선 특허심판원과 특허법원 역시 CU의 손을 들어 준 바 있다.이 소송은 CU의 키핑 쿠폰 서비스가 GS25의 나만의 냉장고 의 특허를 침해했다는 GS리테일의 주장으로 시작됐다. 키핑쿠폰 서비스는 1 증정 행사 대상 상품을 당장 수령하고 싶지 않거나 상품 재고가 점포에 부족할 때 CU의 멤버십 앱 포켓CU에 쿠폰처럼 발급해 주는 기능이다.문제는 GS25가 같은 기능의 서비스를 나만의 냉장고 라는 이름으로 특허를 내 지난 2011년부터 서비스하고 있다는 점이다. 이 때문에 경쟁사들은 그간 1 상품의 추후 사용 서비스를 도입하지 못했다.하지만 CU는 올 초 서비스를 출시하면서 증정상품을 추후에 받을 수 있다는 개념은 같지만 GS25의 경우 앱 내에 상품을 저장했다가 증정하는 방식이고 CU는 증정용 상품을 쿠폰으로 제공하는 방식이기 때문에 서로 다른 서비스라고 주장해 왔다. BGF리테일은 키핑 쿠폰 서비스가 GS리테일의 특허를 침해하는지 특허심판원에 문의했고 특허심판원이 기존 특허를 침해하지 않는다 고 판단하자 서비스를 시작했다.GS리테일은 이에 불복해 소송을 냈지만 특허법원과 대법원에서 잇따라 패소했다. 한 업계 관계자는 증정 상품은 매출과 직결되는 편의점의 핵심 서비스 라며 그간 증정상품 보관 서비스에 대한 평가가 좋았던 만큼 다른 편의점들도 유사한 서비스 개발에 나설 것으로 보인다 고 말했다.김아름기자 armijjang dt.co.krBGF리테일이 GS리테일과의 증정품 보관 서비스 특허 분쟁에서 승소했다.,https://news.naver.com/main/read.nhn?mode=LS2D&mid=shm&sid1=101&sid2=261&oid=029&aid=0002637544
20201122 오후 12:00,101,261,판촉비 떠넘기고 이유없이 반품...GS리테일에 10.6억 과징금,한국경제TV 신선미 기자 GS리테일이 판촉비를 떠넘기고 이유없이 반품하는 등 납품업체에 횡포를 부렸다는 이유로 공정거래위원회로부터 과징금을 부과받았다.공정거래위원회는 건강·미용분야 전문점인 랄라블라 lalavla 를 운영하는 GS리테일에 대규모유통업법 위반을 적발해 과징금 총 10억 5800만 원을 부과했다고 22일 밝혔다.GS리테일의 법 위반 행위는 2016 2017년 집중적으로 이뤄졌다. 공정위의 조사결과 우선 납품업체와의 거래에서 계약서면을 제대로 교부하지 않았다.GS리테일은 2016년 1월부터 2017년 5월까지 총 13개 납품업자와 총 17건의 물품구매공급계약을 체결하면서 계약서를 거래가 개시되기 전까지 교부하지 않았다. 체결하는 즉시 서면교부를 규정한 유통업법 위반이다.또한 같은 기간동안 GS리테일은 25개 납품업자에게 약 7900만원의 SNS 판촉 행사 비용을 떠넘겼다. 심지어 SNS 판촉행사 이용 비용에 대해선 계약서에 명시하지도 않았다.특히 GS리테일은 2016년부터 2년이 넘도록 총 353개 납품업자에게 직매입한 상품 약 98억 상당의 상품을 정당한 사유 없이 반품하기도 했다.공정위는 부당 판매장려금 수취도 적발했다. GS리테일은 2016년 1월부터 1년 반 동안 총 30개 납품업자로부터 판매장려금 약 2억8000만원을 수취했다.상품 대금을 부당하게 감액해 지급한 사실도 드러났다. 38개 납품업자에게 2015년 및 2016년 헬스·뷰티 시상식 행사비용 명목으로 약 5억 3천만 원을 상품대금에서 공제하고 대금을 지급한 것.다만 GS리테일은 부당하게 감액한 금액과 그에 따른 지연이자는 사건 심사과정에서 납품업자에게 지급하고 자진시정 했다.공정위 관계자는 최근 코로나19 위기로 대규모유통업자의 부당한 판촉비 판매장려금 반품비용 등의 비용 전가행위에 대한 유인이 강해질 것으로 우려된다 며 대규모유통업자에 대한 불공정행위 감시활동을 강화할 예정 이라고 밝혔다.,https://news.naver.com/main/read.nhn?mode=LS2D&mid=shm&sid1=101&sid2=261&oid=215&aid=0000917224
20201123 오후 5:20,101,261,농협하나로유통GS리테일 업무협약,서울 연합뉴스 23일 서울 하나로유통 본사에서 열린 공동사업 추진을 위한 업무협약 MOU 체결식에서 조윤성 GS리테일 사장 왼쪽 과 김병수 농협하나로유통 대표이사가 협약 체결 후 기념 촬영을 하고 있다.,https://news.naver.com/main/read.nhn?mode=LS2D&mid=shm&sid1=101&sid2=261&oid=001&aid=0012034324
20201123 오후 4:55,101,261,GS리테일·농협하나로마트 업무협약… 상품 개발부터 배송 함께,GS리테일 007070 과 농협하나로유통은 신제품을 공동 개발하는 내용의 업무 협약 MOU 을 체결했다고 23일 밝혔다. 양사는 신상품 공동 개발 배송 플랫폼 공유 해외 소싱 공동 추진과 관련된 사업 제휴를 추진하기로 했다.조윤성 GS리테일 사장 왼쪽 과 김병수 농협하나로유통 대표이사. GS리테일 제공GS리테일과 농협하나로유통의 구매 담당자 MD 들은 가공식품과 생활용품 등을 공동으로 기획·개발해 생산 물량을 늘리고 원가를 절감해 소비자에게 혜택을 제공할 계획이다. 다음 달부터 농협하나로유통의 농·축·수산품 식재료를 이용해 GS리테일이 도시락 3종을 생산하고 수도권 하나로마트 50개 점포에서 이를 판매한다. 이와 함께 오뚜기 진라면 등 16종 상품도 제조사로부터 공동 매입해 판매할 예정이다.이들은 각 사가 보유한 배송 플랫폼을 공유해 물류 효율화를 도모하고 해외 상품 소싱을 공동으로 추진해 여러 사업에서 시너지 효과를 낼 예정이다. GS리테일은 농협하나로유통과 업무 협약을 통해 근거리 유통 소매 플랫폼의 입지를 강화할 계획이다. GS리테일은 지난 17일 KT와의 디지털 물류 사업 협력을 위한 제휴에 이어 이번 농협하나로유통과의 업무협약까지 체결하며 다양한 사업자들과 손 잡고 근거리 유통 소매 플랫폼의 입지를 강화할 계획이다.GS리테일과 농협하나로마트가 공동 매입하기로 한 오뚜기 진라면. GS리테일 제공GS리테일 관계자는 농·축·수산품 등 1차 상품의 강점을 가진 농협하나로유통과의 업무 협약을 통해 동반 성장하고 고객에게 더 많은 혜택과 가치를 제공하는 계기가 될 것 이라고 말했다.,https://news.naver.com/main/read.nhn?mode=LS2D&mid=shm&sid1=101&sid2=261&oid=366&aid=0000623976
20201123 오전 10:19,101,261,광폭행보 GS리테일 하나로유통과 손잡고 도시락 만든다,23일 MOU 체결…신상 공동 개발하나로유통 식재료로 도시락 생산배송 플랫폼·해외 소싱도 협력GS리테일과 농협하나로마트가 공동 매입하기로 한 오뚜기 진라면. GS리테일이 농협하나로유통과 손 잡으며 업무 제휴의 광폭 행보를 이어간다.23일 GS리테일은 서울 마포구 하나로유통 본관에서 농협하나로유통과 공동사업 추진을 위한 업무협약 MOU 을 체결한다고 밝혔다.이날 협약식에는 GS리테일의 조윤성 사장과 김종수 전무 농협하나로유통의 김병수 대표이사와 이석희 본부장이 참석한다.양사는 이번 MOU를 계기로 신상품의 공동 개발 배송 플랫폼의 상호 공유 해외 소싱의 공동 추진 등과 관련한 사업제휴를 추진하기로 했다.신상품의 공동 개발을 위해 양사의 구매 담당자 MD 들이 협력할 계획이다. 양사는 가공식품 생활용품 등 다양한 상품을 공동으로 기획·개발해 생산 물량은 늘리고 원가는 절감해 소비자에게 더 많은 혜택을 제공할 방침이다.12월부터는 농협하나로유통에서 유통하는 농수축산품 식재료로 GS리테일이 도시락 3종 등을 생산해 수도권 지역의 농협하나로마트 50여개 점에서 판매한다. 이와 함께 양사는 오뚜기 진라면 등 16종의 상품을 제조사로부터 공동 매입해 함께 판매에 나선다.또 각 사가 보유한 배송 플랫폼을 공유해 물류의 효율화를 도모하는 한편 해외 상품 소싱도 공동으로 추진해 여러 사업 영역에 걸쳐 시너지를 확대할 예정이다.GS리테일은 지난 17일 KT와의 디지털 물류 사업 협력을 위한 제휴에 이어 이번 농협하나로유통과의 업무협약까지 체결하며 다양한 사업자들과 손 잡고 근거리 유통 소매 플랫폼의 입지를 강화할 계획이다.김종수 GS리테일 전무 MD본부장 는 GS리테일은 그간 끊임 없는 혁신을 통해 사업의 효율성 제고를 위한 노력을 다 해왔다 며 농수축 1차 상품 강점을 가진 농협하나로유통과의 이번 업무 협력이 양사의 동반성장 뿐 아니라 고객에게 더 많은 혜택과 높은 가치를 제공하는 계기가 될 것 이라고 했다.,https://news.naver.com/main/read.nhn?mode=LS2D&mid=shm&sid1=101&sid2=261&oid=009&aid=0004701068
20201123 오전 10:02,101,261,GS리테일농협하나로 맞손…신상품 공동개발·배송 플랫폼 공유,한국경제TV 신선미 기자 GS리테일이 이번에는 농협하나로유통과 손을 잡았다.GS리테일은 농협하나로유통과 신상품 공동 개발 배송 플랫폼 공유 해외 소싱의 공동 추진 등의 사업 제휴를 진행하기로 했다고 23일 밝혔다.우선 신상품 공동 개발을 위해 양사 구매 담당자 MD 들도 머리를 맞댄다. GS리테일은 12월부터 농협하나로유통의 농수축산품 식재료로 도시락 3종을 생산해 수도권 지역 농협하나로마트 50여개점에서 판매한다. 양측은 또 오뚜기 진라면 등 상품 16종을 제조사로부터 공동 매입해 함께 판매한다. 상품 매입 규모가 커지는 만큼 가격을 더 낮출 수 있다고 GS리테일 관계자는 설명했다.각사가 보유한 배송 플랫폼을 공유해 물류 효율화도 도모하고 해외 상품 구매 소싱 도 공동으로 추진해 시너지를 높일 계획이다. 양사는 이날 오후 이런 내용을 담은 업무협약을 체결한다.GS리테일 관계자는 가공식품과 생활용품 등 다양한 상품을 공동으로 기획·개발해 생산물량은 늘리고 원가는 절감해 소비자에게 더 많은 혜택을 제공할 계획 이라고 말했다.GS리테일은 다양한 사업자들과 손잡고 근거리 유통 소매 플랫폼의 입지를 강화한단 계획이다. 농협하나로유통과의 업무협약 체결에 앞서 물류 최적화를 위해 KT와 제휴했다.,https://news.naver.com/main/read.nhn?mode=LS2D&mid=shm&sid1=101&sid2=261&oid=215&aid=0000917376
