20201124 오후 1:51,101,258,신고가 LG화학 삼바 제치고 시총 3위 꿰차…6거래일째↑,전지사업 성장 지속…수익성 개선 주가 재평가 전망 23일 LG화학이 강세를 나타내며 장중 52주 신고가를 경신했다. 주가 상승에 몸집도 급격히 불어나며 삼성바이오로직스를 제치고 시가총액 3위로 올라섰다. 사진 LG화학 로고.LG화학 주가가 강세를 나타내며 52주 신고가를 경신했다. 주가 상승에 몸집도 급격히 불어나면서 삼성바이오로직스를 제치고 시가총액 3위를 꿰찼다.24일 유가증권시장에서 오후 1시37분 현재 LG화학은 전날보다 3만5000원 4.68% 오른 78만3000원에 거래 중이다. 테슬라 차량 배터리 공급 소식이 전해진 전날에 이어 이틀째 강세다. 외국인 매수세도 지속되며 주가는 17일 이후 6거래일 연속 오르고 있다. 현재 매수상위에는 CS증권 모건스탠리 메릴린치 등이 이름을 올리고 있다.연일 주가가 오르면서 시가총액 규모도 확대됐다. LG화학은 이날 장중 78만8000원까지 오르며 52주 신고가를 경신했다. 신고가 기준으로 시가총액 규모는 55조6260억원으로 늘어나며 삼성바이오로직스를 제치고 시총 3위로 올라섰다.황성현 유진투자증권 연구원은 글로벌 탈탄소 정책 흐름의 변화가 없는 한 전지사업의 성장은 지속될 수 밖에 없다 며 에너지솔루션 물적분할 화재사건 등 잡음이 해소될 경우 모든 사업부의 수익성이 개선되고 주가 재평가로 이어질 것 이라고 분석했다.,https://news.naver.com/main/read.nhn?mode=LS2D&mid=shm&sid1=101&sid2=258&oid=015&aid=0004455227
20201124 오전 10:55,101,258,특징주LG화학 外인의 힘 시총 3위 탈환,이데일리 이지현 기자 2차 전지 대표주인 LG화학 051910 이 외국인 매수세에 힘입어 강세다. 코스피 시총 3위도 탈환했다.24일 마켓포인트에 따르면 LG화학은 이날 오전 10시 50분 기준 2.94% 2만2000원 오른 77만원에 거래 중이다. 6거래일 연속 상속하고 있는 것이다.외국인이 480억원어치를 순매수하며 상승세를 견인하고 있다. 외국인 보유 비중은 41.66%로 나타났다.LG화학은 지난 8일 바이든 당선 직후 친환경주 강세에 힘입어 코스피 시가총액 3위에 랭크되기도 했다. 하지만 이내 4위로 밀렸다. 이날 연속 상승세에 힘입어 다시 시총 54조3561억원으로 3위에 올랐다. 현재 1위는 삼성전자 005930 411조3180억원 2위는 SK하이닉스 000660 72조8002억원 다. 그동안 삼성바이오로직스 207940 가 3위를 지켜왔지만 이날 1.37% 1만1000원 하락하며 시총 52조4688억원으로 4위로 밀렸다.,https://news.naver.com/main/read.nhn?mode=LS2D&mid=shm&sid1=101&sid2=258&oid=018&aid=0004792925
20201124 오전 9:43,101,258,STOCK“LG화학 바이든 효과로 美 EV시장 회복 기대”,현대차증권은 24일 LG화학에 대해 각국이 팬데믹 극복을 위한 정책으로 전기자동차 EV 전환 가속화되면서 전기차 판매는 상반기 역성장에도 전년비 50% 성장한 300만대를 기록할 것으로 기대했다. 여기에 화학 사업도 최고 수준 펀더멘탈을 보이며 배터리가 고성장 지속될 것으로 전망했다. 매수의견은 유지 목표가는 103만원으로 상향 제시했다. 미국에서의 전기차 판매는 30만대 수준으로 중국 유럽의 3분의 1 미만이다. 중국과 유럽은 고성장 중이나 미국은 올해도 정체로 바이든 행정부 들어서면서 전기차에 우호적인 정책을 기대하고 있다. LG화학 주요 파트너사 중 미국 업체는 테슬라와 GM이 있다. LG화학은 VW 테슬라 GM 현대차 볼보 등 주요 지역 대형 주문자상표부착생산 OEM 을 고객으로 확보하고 있다. 강동진 현대차증권 연구원은 “각국이 팬데믹 극복을 위한 정책으로 에너지 전환 정책을 강하게 드라이브 하는 상황”이라며 “1위 최대 배터리 회사인만큼 화학부문 역시 저평가에서 벗어나며 주가 강세가 이어질 것”으로 전망했다.내년 매출액과 영업이익은 전년동기대비 각각 31.0% 61.9% 상승한 39조9000억원 4조3000억원을 기록할 것으로 전망했다. 주력 화학제품 강세 지속으로 기초소재 영업이익 지난해보다 43.4% 오른 2조9000억원을 전기차용 전지 매출 고성장 및 수익성 개선으로 배터리 사업 영업이익은 101.6% 오른 1조1000억원을 기록할 것으로 전망했다.,https://news.naver.com/main/read.nhn?mode=LS2D&mid=shm&sid1=101&sid2=258&oid=417&aid=0000622752
20201124 오전 9:37,101,258,특징주LG화학·삼성SDI·SK이노 2차전지株 동반강세,서울경제 2차전지 관련주가 이틀째 강세다. 24일 오전 9시 32분 현재 SK이노베이션 096770 은 전거래일보다 2.6% 4 500원 오른 15만8 500원에 거래되고 있다. LG화학도 2.67% 상승한 76만8 000원에 거래 중이며 삼성SDI 006400 도 2.09% 오르며 강세를 보이고 있다. 전날 LG화학이 테슬라 모델 Y에 장착되는 배터리 전량을 공급하기로 했다는 소식이 알려지면서 2차전지 전반에 대한 성장성이 재차 부각되는 모습이다.,https://news.naver.com/main/read.nhn?mode=LS2D&mid=shm&sid1=101&sid2=258&oid=011&aid=0003830741
20201124 오전 9:30,101,258,특징주 LG화학 2%대 상승…시총 3위 재탈환,17일부터 6거래일 연속 상승…시가총액 54조737억원까지↑LG화학 주가 변동 추이 ⓒ한국거래소LG화학이 장 초반 2%넘게 상승하면서 코스피 전체 시가총액 3위 자리를 재탈환했다.24일 한국거래소에 따르면 오전 9시 27분 현재 코스피시장에서 LG화학은 전장보다 1만8000원 2.41% 오른 76만6000원에 거래되고 있다. 지난 17일 1.33% 상승한 이후 18일 3.35% 19일 1.69% 20일 0.42% 23일 3.31% 등 6거래일 연속 상승세다.이에 LG화학의 시가총액도 54조737억3500만원까지 늘어나면서 52조6673억4000만원의 삼성바이오로직스를 제치고 다시 3위 자리에 올랐다.,https://news.naver.com/main/read.nhn?mode=LS2D&mid=shm&sid1=101&sid2=258&oid=119&aid=0002445894
20201124 오전 9:19,101,258,특징주 LG화학 등 2차전지 관련株 상승…美증시 전기차株↑,21일 오전 서울 강남구 코엑스에서 열린 배터리산업 전시회 인터배터리 2020 을 찾은 관람객들이 전시부스를 살펴보고 있다. 올해로 8회째를 맞는 이번 전시에는 자동차 스마트폰 에너지저장장치 ESS 용 배터리와 핵심 소재 등 K 배터리 핵심 기술이 총출동한다.2020.10.21 뉴스1  News1 이재명 기자 서울 뉴스1 정은지 기자 LG화학 등 국내 2차전지 관련주가 상승세를 나타내고 있다. 밤 사이 뉴욕 증시에서 테슬라를 비롯한 전기차 관련 기업 주가가 급등한 영향으로 풀이된다. 24일 오전 9시 13분 기준 SK이노베이션 주가는 전일 대비 5000원 3.25% 오른 15만9000원에 거래되고 있다. LG화학 주가는 1만8000원 2.41% 오른 76만6000원 삼성SDI는 8000원 1.52% 오른 53만4000원을 기록 중이다. KRX뉴딜지수 중 2차전지로 분류된 두산솔루스 1.37% 에코프로비엠 1.33% 천보 0.76% 후성 0.52% 포스코케미칼 0.37% 등도 오름세다. 밤사이 테슬라 주가는 전일 대비 32.24달러 6.58% 오른 521.85달러로 거래를 마쳤다. 또한 미국 증시에 상장된 중국 전기차 업체인 샤오펑 33.92% 리오토 14.48% 니오 12.45% 등도 강세로 마감했다.,https://news.naver.com/main/read.nhn?mode=LS2D&mid=shm&sid1=101&sid2=258&oid=421&aid=0005008217
20201125 오전 10:49,101,258,테슬라 급등에 미소 짓는 LG화학‧SK이노베이션,테슬라 주가가 급등하면서 국내 2차전지 관련주도 강세를 보이고 있다. LG화학은 7거래일 연속 상승세로 이날 장중 최고가를 경신했다. 25일 오전 10시9분 현재 전 거래일보다 1만원 1.25% 오른 80만9000원에 거래되고 있다. SK이노베이션은 전 거래일보다 8500원 5.31% 오른 16만85000원에 거래되고 있다. 삼성SDI는 장중 56만원대까지 올랐지만 차익실현 매물에 하락 전환했다.24일 현지시간 미국의 전기차업체 테슬라의 시가총액이 사상 처음 5000억달러 약 555조원 를 넘어선 것이 긍정적으로 작용했다. 다음달 21일 스탠다드앤드푸어스 S P 500지수 편입을 앞두고 매수세가 증가하면서 상승을 이끌었다. 테슬라는 지난 1월22일 시총 1000억달러를 넘은 이후 불과 10개월여 만에 5배 증가했다. 지난 3분기 13만9300대를 인도해 자체 신기록을 세웠고 같은 기간 매출 97억7000만달러 달성 5개 분기 연속 흑자를 냈다.LG화학은 지난 17일부터 7거래일 연속 상승세다. 현재 시가총액은 57조386억원으로 삼성전자 SK하이닉스에 이어 코스피 시가총액 순위 3위에 올랐다. 최근 LG화학인 테슬라와 전기차용 배터리 공급 계약을 맺고 중국 상하이 공장에서 양산되는 테슬라의 모델Y에 배터리를 납품하기로 했다. SK이노베이션의 주가는 5%대로 오르는 중이다. 신종코로나바이러스 감염증 코로나19 백신 개발 소식과 미국 정권이양 기대감에 국제유가가 상승한 점이 영향을 미쳤다. 앞서 24일 현지시간 미국 서부텍사스원유 WTI 1월 인도분 선물은 전장 대비 1.85달러 4.3% 상승한 배럴당 44.91달러에 거래를 마치며 올해 3월 초 수준을 회복했다.,https://news.naver.com/main/read.nhn?mode=LS2D&mid=shm&sid1=101&sid2=258&oid=417&aid=0000623402
20201125 오전 10:02,101,258,특징주 LG화학 또 사상 최고가 경신,2차전지주인 LG화학이 연일 상승세다.25일 오전 9시52분 현재 LG화학은 전 거래일보다 1만2000원 1.50% 오른 81만1000원에 거래되고 있다. 현재 시가총액은 57조3210억원으로 삼성전자 SK하이닉스에 이어 코스피 시가총액 순위 3위다. 주가에는 친환경 전기차에 대한 기대감이 반영됐다. 최근 LG화학인 테슬라와 전기차용 배터리 공급 계약을 체결하고 24일 현지시간 미국의 전기차업체 테슬라의 시가총액이 사상 처음 5000억달러 약 555조원 를 넘어선 것이 긍정적인 영향으로 작용하고 있다. LG화학은 최근 7거래일 연속 상승 마감했다. 전날 80만원을 돌파해 이날 80만원대를 유지 중이다.,https://news.naver.com/main/read.nhn?mode=LS2D&mid=shm&sid1=101&sid2=258&oid=417&aid=0000623346
20201125 오전 9:38,101,258,테슬라 주가 폭등에 2차전지주 훨훨…LG화학 최고가,테슬라 주가 급등에 시총 5000억달러 돌파LG화학 장중 83만3000원…7거래일째 상승LG화학 직원들이 충북 오창 사업장에서 전기차용 배터리를 들여다보고 있다. 사진 한경DB미국 전기차업체 테슬라 주가가 고공행진 중인 가운데 국내 2차전지 관련주들도 급등하고 있다.25일 유가증권시장에서 오전 9시30분 현재 LG화학은 전날보다 1만6000원 2.0% 상승한 81만5000원에 거래 중이다. 7거래일 연속 상승세로 이날 장중에는 83만3000원까지 오르며 최고가를 경신했다. 같은 시간 SK이노베이션은 5% 강세를 나타내고 있다. 삼성SDI는 장중 56만3000원까지 오르며 신고가를 경신한 후 차익실현 매물이 나오자 하락 전환했다.2차전지 관련주가 상승 랠리를 펼치는 배경은 외국인 러브콜이 이어지고 뉴욕증시에서 테슬라를 포함한 전기차 기업들의 주가가 상승한 영향을 받았다.미국 전기차업체 테슬라 로고. 사진 한경DB.24일 현지시간 뉴욕증시에서 테슬라는 6.43% 급등한 555.38달러로 마감했다. 테슬라는 540.40달러로 출발해 종가 기준 시총 5175억달러를 기록했다. 지난 1월 22일 시총 1000억달러 고지를 처음 밟은 지 불과 10개월여 만에 5배 불어난 셈이다.긍정적인 실적과 호재가 테슬라 주가를 밀어올렸다. CNBC방송에 따르면 테슬라는 지난달 발표한 3분기 실적을 통해 5개 분기 연속 흑자를 보고했고 3분기 13만9300대의 제품을 고객에게 인도해 자체 신기록을 세웠다.최근에는 스탠더드앤드푸어스 S P 500 지수에 편입되는 호재로 주가가 더욱 탄력을 받았다.,https://news.naver.com/main/read.nhn?mode=LS2D&mid=shm&sid1=101&sid2=258&oid=015&aid=0004455787
20201125 오전 9:12,101,258,특징주 고속질주하는 테슬라...LG화학·삼성SDI·SK이노 초강세,LG화학은 80만원 돌파일론 머스크. 로이터연합뉴스 서울경제 LG화학·삼성SDI 006400 ·SK이노베이션 096770 등 국내 배터리 3사의 주가가 상승세를 이어가고 있다. 미국 전기차 업체 테슬라의 주가가 고공행진을 이어가면서 주요 전기차 종목들의 상승 랠리에 영향을 받는 것으로 풀이된다.25일 오전 9시 6분 LG화학은 전일 대비 3.75% 오른 82만9 000원에 거래면서 80만원 고지를 뚫었다. SK이노베이션도 같은 시각 5.94% 오른 16만9 500원에 거래됐고 삼성SDI는 1.3%대의 강세를 나타냈다. 한편 24일 현지 시각 테슬라는 전일 대비 6.43% 오른 555.38달러로 거래를 끝내며 사상 최고가를 기록했다.,https://news.naver.com/main/read.nhn?mode=LS2D&mid=shm&sid1=101&sid2=258&oid=011&aid=0003831367
20201125 오전 3:50,101,258,삼성전자 이틀 연속 최고가…LG화학 시총 3위 껑충,머니투데이 김태현 기자 코스피지수가 연일 최고치를 경신하고 있는 가운데 몸집이 대형주가 큰 폭으로 올랐다. 특히 외국인의 순매수가 몰린 삼성전자와 LG화학의 상승세가 가파르다. 24일 삼성전자는 전 거래일 대비 200원 0.3% 오른 6만7700원을 기록했다. 이틀 연속 사상 최고가를 경신했다. 장중 한때 6만9500원까지 올랐다. 7만원 고지가 눈앞이다.LG화학은 5만1000원 6.82% 급등한 79만9000원을 기록했다. 52주 신고가다. 시가총액 56조4033억원으로 삼성바이오로직스 53조643억원 을 제치고 3위로 올라섰다.코로나19 COVID 19 직후 상대적으로 상승폭이 적었던 걸 감안하면 눈에 띄는 오름세다. 코스피지수는 연저점 1482.46 인 3월 23일 이후 지난달 말까지 52.9% 올랐다. 반면 같은 기간 삼성전자 주가는 33.2% 상승하는데 그쳤다.외국인의 적극적인 순매수가 삼성전자와 LG화학의 주가 급등을 이끌었다. 한국거래소에 따르면 11월 이후 외국인이 가장 많이 순매수한 종목은 삼성전자와 LG화학으로 각각 2조2990억원 23일 기준 1조1103억원 어치의 주식을 사들였다.서상영 키움증권 연구원은 반도체와 2차전지를 중심으로 순매수가 집중됐다 며 조 바이든 행정부에 대한 긍정적인 전망과 경기 부양 기대가 반영됐다 고 설명했다. 코로나19 확산에도 수출이 증가하고 있다는 점도 긍정적이다. 한국의 대표 수출 품목인 반도체와 2차전지 업체에 대한 실적 기대감도 높아지는 부분이다.전날 관세청이 발표한 수출입현황 속보치 에 따르면 이달 1 20일 수출액은 313억원 약 34조8807억원 으로 전년동기 대비 11.1% 증가했다. 반도체가 수출을 이끌었다.신승진 삼성증권 연구원은 달러 약세에 따른 신흥국 자금 유입 구간에서 상대적 이익 모멘텀이 양호한 수출주의 상대적 매력이 부각될 수 있는 시기 라고 설명했다.,https://news.naver.com/main/read.nhn?mode=LS2D&mid=shm&sid1=101&sid2=258&oid=008&aid=0004504486
20201126 오후 5:46,101,258,LG하우시스 온산산단 토지·건물 LG화학 등에 양도,아시아경제 배경환 기자 LG하우시스는 자산 매각을 통한 자산 효율화를 위해 12월 중 온산산업단지 내 토지와 건·구축물을 LG화학과 LG생활건강에 각각 198억원 146억원에 양도하기로 결정했다고 26일 공시했다.,https://news.naver.com/main/read.nhn?mode=LS2D&mid=shm&sid1=101&sid2=258&oid=277&aid=0004799534
20201126 오후 5:20,101,258,LG하우시스 온산산단 내 토지·건물 LG화학·생건에 344억원에 양도,이데일리 경계영 기자 LG하우시스 108670 는 자산 효율화를 목적으로 12월 중 온산산업단지 내 토지와 건·구축물을 LG화학과 LG생활건강에 각각 198억원 146억원에 양도키로 했다고 26일 공시했다.,https://news.naver.com/main/read.nhn?mode=LS2D&mid=shm&sid1=101&sid2=258&oid=018&aid=0004795324
20201126 오후 4:39,101,258,LG화학 외국인 8일 연속 매수에 첫 80만원 돌파,LG화학 폴란드 공장 LG화학 제공 서울 연합뉴스 김태종 기자 LG화학 주가가 외국인의 계속된 매수세에 힘입어 80만원을 처음 넘어섰다. LG화학은 26일 유가증권시장에서 전날보다 3.55% 2만8천원 오른 81만6천원에 마감했다. 장중 80만원을 넘어선 적은 있지만 종가로는 이날이 처음이다. 전날에는 83만8천원까지 상승했다가 1.38% 하락한 78만8천원에 마감한 바 있다. 이날은 장중 82만1천원까지 오른 뒤 다소 하락했으나 지난 26일 기록했던 종전 최고가 종가 79만9천원 를 뛰어넘어 마쳤다. 시가총액도 57조6천억원까지 늘어나며 3위 자리를 확고히 했다. 이날 기관과 외국인이 각각 4만1천주와 2만8천주를 순매도했지만 외국인이 6만9천주를 추가로 사들이며 주가 상승을 이끌었다. 외국인은 지난 17일부터 8거래일 연속 순매수를 이어오고 있다. 특히 이달 19거래일 중 단 이틀만 제외하고 17거래일 동안 순매수했다. 이에 LG화학은 지난달 말 61만1천원에서 이달에만 33.5% 급등했다. 이 같은 외국인 매수세는 세계 전기차 배터리 점유율 1위로서의 위치 향후 실적에 대한 기대감 때문으로 풀이된다. 시장조사업체 SNE리서치에 따르면 LG화학은 올해 1∼9월 판매된 글로벌 전기차 EV PHEV HEV 탑재 배터리 사용량 순위에서 1위 자리를 유지했다. 삼성SDI도 이날 2.23% 1만2천원 오른 55만원에 SK이노베이션은 7.03% 1만1천500원 급등한 17만5천원에 마감하는 등 배터리 3사가 모두 크게 올랐다. 강동진 현대차증권 연구원은 각국이 신종 코로나바이러스 감염증 코로나19 팬데믹 세계적 대유행 극복을 위해 전기차 EV 로 전환에 속도를 내고 있어 배터리 부문의 고성장이 계속될 것 이라고 전망했다.,https://news.naver.com/main/read.nhn?mode=LS2D&mid=shm&sid1=101&sid2=258&oid=001&aid=0012042973
20201126 오후 3:51,101,258,LG화학 주가 80만원대 최고가…이달 상승률 34% 시총 3위,LG화학 오창 전기차배터리 생산라인 LG화학친환경 수혜주로 각광받고 있는 LG화학 주가가 역대 최고가 행진을 벌이며 80만원대에 진입했다.26일 유가증권시장에서 LG화학은 전날보다 2만8000원 3.55% 오른 81만6000원에 거래를 마쳤다. 지난 24일 세운 종가 기준 최고가 79만9000원 기록을 이틀 만에 경신한 것이다.24일 삼성바이오로직스를 제치고 국내 증시 시가총액 3위 자리를 꿰찬 LG화학의 시총은 57조6033억원까지 불어났다.LG화학의 이달 주가 상승률은 33.6% 61만1000원→81만6000원 나 된다.LG화학의 주가가 가파르게 상승한 것은 ‘전기차 배터리’ 때문이다. 미국 대통령으로 당선된 조 바이든 민주당 대선 후보가 적극적인 친환경 정책을 펴겠다고 공언한데다 유럽도 저탄소 정책을 강하게 밀어붙이고 있어서 전기차 시장은 향후 급성장할 것으로 보이는 상황이다.LG화학은 세계 전기차 배터리 시장 1위 업체로 이에 따른 수혜를 누릴 것으로 예상된다.최근 테슬라가 중국 상하이 공장에서 양산되는 ‘모델 Y’에 LG화학의 배터리를 쓴다는 소식이 전해지기도 했다.유진투자증권 황성현 연구원은 “LG화학은 대표적인 ‘저탄소 전환기업’으로 저탄소 관련 특허를 5000개 이상 갖고 있다”며 “LG화학 전지사업부의 외형과 수익성 성장은 지속될 것”이라고 말했다.에프앤가이드에 따르면 증권사 21곳이 제시한 LG화학의 적정 주가는 93만8667원에 달한다.LG화학은 지난 9월 16일 배터리 사업 부문을 분할한다고 발표하면서 주가가 60만원대 초반까지 떨어지기도 했다. 하지만 이후 외국인의 적극적인 매수에 힘입어 반등에 성공했다.외국인은 이달 들어서만 LG화학 주식을 1조5000억원 가량 순매수했다. 반면 개인들은 1조3300억원 가량 순매도했다.,https://news.naver.com/main/read.nhn?mode=LS2D&mid=shm&sid1=101&sid2=258&oid=023&aid=0003579075
20201126 오후 3:24,101,258,국민연금 SK텔레콤 분할 찬성...LG화학과 다른 판단 이유는,같은 물적분할이지만 SK텔레콤은 찬성표 분사규모 작고 기존 주주 반발 미미 영향 서울 뉴시스 박정호 SK텔레콤 사장이 26일 오전 서울 을지로 본사 수펙스홀에서 열린 임시 주주총회에서 주주들에게 모빌리티 사업 추진 의미와 비전을 설명하고 있다. 사진 SK텔레콤 제공 2020.11.26.photo newsis.com 서울 뉴시스 류병화 기자 국민연금이 SK텔레콤의 임시 주주총회에서 물적분할 안건에 찬성표를 던진 것으로 나타났다. LG화학과 비슷한 구조를 띠고 있지만 다른 판단 결과를 내리게 된 배경에 관심이 쏠린다.26일 금융투자업계에 따르면 국민연금은 SK텔레콤 임시 주주총회에서 분할계획서 승인 안건에 대해 찬성 의결권을 행사했다. 국민연금은 의결권 등 주주권 행사 논의기구인 수탁자책임전문위원회에 맡기지 않고 기금운용본부가 직접 판단을 내렸다.이날 열린 SK텔레콤 주총에서 분할 안건은 국민연금의 찬성에 무난히 통과됐다. 주식 총수의 81.64%가 투표에 참여했으며 참석 주식 총수 99.98%의 찬성으로 최종 통과됐다.금융투자업계에서는 SK텔레콤과 LG화학이 비슷한 구조를 띠고 있어 반대표를 행사할 수도 있다고 봤다.SK텔레콤은 모빌리티 사업부문을 물적분할해 티맵모빌리티 가칭 를 신설하기로 했다. 티맵모빌리티를 SK텔레콤 100% 비상장 자회사로 둘 예정이며 추후 기업공개 IPO 등을 통한 자금 조달 가능성이 열려 있다.이는 국민연금의 반대를 받은 LG화학의 물적분할 구조와 흡사하다. LG화학은 배터리 사업을 떼어내 LG에너지솔루션을 신설하고 LG화학이 이 비상장 신설법인의 지분 100%를 갖기로 했다.국민연금이 SK텔레콤에 대해 LG화학과 다른 판단을 내린 배경으로는 회사 전체에서 떼어지는 신설 회사의 규모가 작은 점 이에 SK텔레콤 주주들이 모빌리티 사업을 보고 투자에 나섰다고 보기 어려운 점 외부 투자를 투명하게 공개한 점 등이 꼽힌다.SK텔레콤에서 떼어져 나가는 티맵모빌리티는 자산총계 기준 1860억원으로 존속회사인 SK텔레콤 자산의 0.60%에 불과하다. LG화학의 경우 떼어진 LG에너지솔루션이 존속회사 자산의 41.5%를 차지했다. 비중 면에서 상당한 차이가 있는 것이다.이에 국민연금은 SK텔레콤에 투자한 주주 입장에서 봤을 때 모빌리티 사업부를 보고 SK텔레콤 주식을 매입하지 않아 찬성 의결권 행사를 결정한 것으로 풀이된다.또 티맵모빌리티는 우버로부터 5000만 달러 약 572억원 를 투자 유치 받기로 했다. 이외에도 우버와 티맵모빌리티가 함께 출범시키는 합작사에는 1억 달러 약 1145억 달러 이상을 투자하는 합의도 이뤄졌다. SK텔레콤은 이를 사전에 알려 소통 측면에서 잡음이 일지 않아 국민연금의 결정에 긍정적인 영향을 준 것으로 보인다.금융투자업계 관계자는 물적분할은 경영 판단이고 그 자체로 문제이지 않다 면서 이번 SK텔레콤의 경우에도 기금운용본부가 여러 자료를 참고해 주주가치가 떨어지는지를 파악해 선택했을 것 이라고 전했다.,https://news.naver.com/main/read.nhn?mode=LS2D&mid=shm&sid1=101&sid2=258&oid=003&aid=0010208797
