20201105 오전 8:17,101,261,LG화학네스테 전략적 파트너십 체결..“바이오 원료로 친환경 수지 생산”,LG화학 고부가 제품에 네스테 바이오 원료 활용한 시너지 기대 자원 선순환 활동 및 온실가스 저감 등 지속가능성 전략 강화 “2050 탄소중립 성장 달성 위해 자원 선순환 사업 지속 확대할 것” 이데일리 김영수 기자 LG화학이 바이오 원료를 활용해 친환경 합성수지 생산에 나선다.5일 LG화학 051910 은 세계 최대 바이오 디젤 기업인 핀란드 Neste 네스테 와 바이오 기반의 친환경 사업 및 관련 시장 확대를 위한 전략적 파트너십 MOU 을 체결했다고 밝혔다. 네스테는 자체 공정 기술을 보유한 바이오 디젤 분야 최고의 선도 업체로 전사 영업이익의 80%가 바이오 원료 및 이를 기반으로 한 친환경 제품에서 창출되는 글로벌 기업이다. LG화학 여수공장 용성단지. 사진 LG화학 이번 협약으로 양사는 바이오 원료를 기반으로 한 다양한 제품의 상업화 기회를 함께 모색하며 시장 경쟁력을 강화하는 한편 아시아 유럽 및 글로벌 시장 정보를 공유하고 신용도 제품 개발에도 적극 협력키로 했다. 구체적인 수량과 협력 기간은 양사의 협약에 따라 밝힐 수 없지만 LG화학은 향후 수년간 친환경 합성수지 생산에 필요한 바이오 원료를 안정적으로 공급 받을 수 있을 전망이다. 네스테의 바이오 원료는 재생 가능한 폐식용유 팜오일 등의 식물성 기름으로 생산되며 화석 원료 대비 온실가스 저감 효과가 매우 큰 친환경 물질이다. 이를 통해 LG화학은 바이오 원료 기반의 PO 폴리올레핀 SAP 고흡수성수지 ABS 고부가합성수지 PC 폴리카보네이트 PVC 폴리염화비닐 등을 생산할 계획이다. 내년 하반기 내 실질적인 제품 생산을 목표로 하고 있다.네스테는 바이오 원료 사업을 석유화학 분야로도 확대시켜 사업 포트폴리오를 다각화하는 한편 LG화학의 기술력 및 수직계열화 기반의 다양한 고부가 제품에 재생 가능한 바이오 원료를 접목시킬 수 있게 됐다. 이번 협약은 지속가능성 전략의 일환으로 탄소 중립 및 자원 선순환 활동에 집중하고 있는 LG화학과 화학 분야로의 사업 포트폴리오를 확대하려는 네스테의 이해관계가 맞아 떨어졌기 때문이다.노국래 LG화학 석유화학사업본부장은 “국내대표 화학기업인 LG화학의 기술력과 세계 최대 바이오 디젤 기업인 네스테의 지속가능성이 결합해 양사 모두 글로벌 경쟁력을 강화하는 협력 체계를 구축했다”며 “LG화학은 ‘2050 탄소중립 성장’ 달성을 위해 바이오 원료 및 친환경 소재 기반의 자원 선순환 사업을 지속 확대해 나갈 것”이라고 말했다.LG화학은 이번 파트너십을 통해 탄소 배출 및 온실가스 저감을 통한 지속가능성 Sustainability 전략에 박차를 가한다. 앞서 LG화학은 지난 7월 국내 화학 업계 최초로 기후변화 대응을 위한 ‘2050 탄소 중립 성장’을 선언했다. 이를 위해 석유화학 분야에서는 PCR ABS 및 생분해성 신소재 등을 자체 개발하며 자원 선순환 및 순환경제 구축에 앞장서고 있으며 이번 파트너십을 계기로 다양한 주력 제품군에 바이오 원료를 적용할 수 있게 됐다. 화석 원료를 바이오 원료로 대체할 시 동일한 투입량 기준 기존 제품 대비 온실가스를 약 50% 가량 저감할 수 있다. LG화학은 향후 바이오 원료를 적용하는 비중을 점진적으로 늘릴 계획이다.LG화학은 바이오 원료로 생산하는 친환경 수지에 대한 ISCC 인증도 추진할 계획이다. ISCC International Sustainability and Carbon Certification 는 250여개의 친환경 원료 제조사 NGO 및 연구기관 등으로 구성된 국제 인증 기관으로 바이오 원료 구매 및 투입량을 기준으로 탄소배출 저감량을 산정해 생산된 최종 제품에 인증을 부여한다. LG화학은 내년 상반기 내 ISCC 바이오 인증 획득을 목표로 하고 있다. 이를 통해 탄소는 줄이고 물성은 기존과 동일한 친환경 합성수지로 관련 시장을 적극 공략할 계획이다.,https://news.naver.com/main/read.nhn?mode=LS2D&mid=shm&sid1=101&sid2=261&oid=018&aid=0004777748
20201105 오전 8:12,101,261,LG화학 세계 최대 바이오 디젤 기업 네스테와 MOU 체결,LG화학 친환경 합성수지 바이오 원료 안정적으로 공급받아내년 하반기 실질적 제품 생산 목표 아시아경제 황윤주 기자 LG화학이 바이오 원료를 활용해 친환경 합성수지 생산에 나선다.LG화학은 5일 세계 최대 바이오 디젤 기업인 핀란드 Neste 네스테 와 바이오 기반의 친환경 사업 및 관련 시장 확대를 위한 전략적 파트너십 MOU 을 체결했다고 밝혔다.네스테는 자체 공정 기술을 보유한 바이오 디젤 분야 최고의 선도 업체로 전사 영업이익의 80%가 바이오 원료 및 이를 기반으로 한 친환경 제품에서 창출되는 글로벌 기업이다.이번 협약으로 양사는 바이오 원료를 기반으로 한 다양한 제품의 상업화 기회를 함께 모색하며 시장 경쟁력을 강화하는 한편 아시아 유럽 및 글로벌 시장 정보를 공유하고 신용도 제품 개발에도 적극 협력하기로 했다. 내년 하반기 내 실질적인 제품 생산을 목표로 하고 있다.구체적인 수량과 협력 기간은 양사의 협약에 따라 밝힐 수 없지만 LG화학은 향후 수년간 친환경 합성수지 생산에 필요한 바이오 원료를 안정적으로 공급 받을 수 있을 전망이다.네스테의 바이오 원료는 재생 가능한 폐식용유 팜오일 등의 식물성 기름으로 생산되며 화석 원료 대비 온실가스 저감 효과가 매우 큰 친환경 물질이다. 이를 통해 LG화학은 바이오 원료 기반의 PO 폴리올레핀 SAP 고흡수성수지 ABS 고부가합성수지 PC 폴리카보네이트 PVC 폴리염화비닐 등을 생산할 계획이다.이번 협약은 지속가능성 전략의 일환으로 탄소 중립 및 자원 선순환 활동에 집중하고 있는 LG화학과 화학 분야로의 사업 포트폴리오를 확대하려는 네스테의 이해관계가 맞아 떨어졌기 때문이다. 네스테는 바이오 원료 사업을 석유화학 분야로도 확대시켜 사업 포트폴리오를 다각화하는 한편 LG화학의 기술력 및 수직계열화 기반의 다양한 고부가 제품에 재생 가능한 바이오 원료를 접목시킬 수 있게 됐다.LG화학은 이번 파트너십을 통해 탄소 배출 및 온실가스 저감을 통한 지속가능성 Sustainability 전략에 박차를 가한다.LG화학은 지난 7월 국내 화학 업계 최초로 기후변화 대응을 위한 2050 탄소 중립 성장 을 선언했다. 이번 파트너십을 계기로 다양한 주력 제품군에 바이오 원료를 적용할 수 있게 됐다. 화석 원료를 바이오 원료로 대체할 시 동일한 투입량 기준 기존 제품 대비 온실가스를 약 50% 가량 저감할 수 있다. LG화학은 향후 바이오 원료를 적용하는 비중을 점진적으로 늘려 나아갈 계획이다.또 LG화학은 내년 상반기 내 바이오 원료로 생산하는 친환경 수지에 대한 ISCC 인증 획득을 목표로 하고 있다. 이를 통해 탄소는 줄이고 물성은 기존과 동일한 친환경 합성수지로 관련 시장을 적극 공략할 계획이다.,https://news.naver.com/main/read.nhn?mode=LS2D&mid=shm&sid1=101&sid2=261&oid=277&aid=0004786063
20201105 오전 8:20,101,261,그래픽 LG화학·SK이노 배터리 소송 공방 일지,서울 연합뉴스 이재윤 기자 SK이노베이션이 LG화학을 상대로 미국 국제무역위원회 ITC 에 제기한 특허침해 소송의 최종 판결 기일이 내년 11월 30일로 정해졌다. 이 소송은 다음 달 1일 LG화학에서 분사하는 배터리 사업부문 신설법인 LG에너지솔루션 가칭 이 승계할 전망이다.,https://news.naver.com/main/read.nhn?mode=LS2D&mid=shm&sid1=101&sid2=261&oid=001&aid=0011993668
20201105 오전 8:02,101,261,SK이노LG화학 특허 소송건… 美 ITC 내년 11월 최종 판결,지난달 21일 서울 삼성동 코엑스에서 열린 인터배터리 2020 에서 관람객들이 SK이노베이션 부스를 살펴보고 있다. 사진 박동욱기자 fufus 디지털타임스 박정일 기자 SK이노베이션이 LG화학을 상대로 미국 국제무역위원회 ITC 에 제기한 특허침해 소송의 최종 판결 기일이 내년 11월 30일로 정해졌다.5일 업계에 따르면 ITC는 최근 SK이노베이션이 자사의 배터리 특허 기술 994 특허 을 침해했다며 LG화학을 상대로 제기한 특허소송의 최종 판결 기일을 내년 11월 30일로 잡았다. 변론 기일은 내년 3월 15일부터 5일 동안 진행된다.위원회의 최종판결 전 ITC 행정판사가 예비결정을 내리는 기일은 내년 7월 30일이다. 특허 소송에서는 ITC 행정판사의 예비결정 가운데 약 90％가 ITC 위원회 최종결정에서도 유지된다.앞서 LG화학은 지난해 4월 먼저 SK이노베이션이 자사의 배터리 핵심 인력을 빼가 영업 비밀을 침해했다며 ITC와 미국 델라웨어 지방법원에 소송을 제기했다. 같은 해 9월 SK이노베이션은 자사의 994 특허를 침해하는 배터리 제품을 LG화학이 미국에서 팔고 있다며 ITC에 특허소송을 제기했고 LG화학은 오히려 SK이노베이션이 특허를 침해했다며 ITC에 추가 소송을 제기했다.ITC는 LG화학이 처음 제기했던 영업비밀 침해 소송에 대해 내달 10일 최종 판결을 내릴 예정이다.ITC는 올해 2월 SK이노베이션에 조기 패소 예비결정을 내렸다.SK이노베이션이 LG화학을 상대로 제기한 특허소송은 내년 11월 30일 반대로 LG화학이 SK이노베이션을 상대로 제기한 특허소송은 내년 7월 19일 최종 판결이 나올 예정이다.LG화학의 배터리 사업 부문 분사에 따라 LG화학이 그간 소송 당사자로 참여해온 배터리 기술 영업비밀·특허소송은 내달 1일 출범하는 LG에너지솔루션 가칭 이 승계할 전망이다. LG화학 관계자는 ITC를 비롯해 배터리 사업 관련 소송은 분사 이후 신설 법인이 승계하는 것이 원칙 이라며 미국 현지의 법적 이슈와 충돌하는 것은 없는지 세부 내용을 검토하고 있다 고 설명했다.,https://news.naver.com/main/read.nhn?mode=LS2D&mid=shm&sid1=101&sid2=261&oid=029&aid=0002634617
20201105 오전 7:51,101,261,LG화학 오창공장서 코로나19 확진자 발생…충북 누적 195명,청주 연합뉴스 박종국 기자 LG화학 청주 오창공장에서 신종 코로나바이러스 감염증 코로나19 확진자가 발생했다.코로나 19 연합뉴스 자료 사진 5일 청주시와 LG화학에 따르면 오창공장에서 근무하는 50대 A씨가 전날 검체 검사를 받은 결과 양성 판정을 받아 청주의료원으로 이송됐다. A씨는 지난달 27일부터 오한과 콧물 증세를 보이자 검체 검사를 받았다. LG화학은 해당 공장을 폐쇄하고 보건 당국과 함께 A씨 가족 동료 등 접촉자들을 파악 자가 격리한 뒤 검체 검사를 벌이고 있다. LG화학 관계자는 방역당국과 협력 추가 감염을 막기 위해 방역 등 적극적인 조처를 통해 공장 가동에 차질이 없도록 하겠다 고 말했다. 충북 누적 코로나19 확진자는 195명으로 늘었다.,https://news.naver.com/main/read.nhn?mode=LS2D&mid=shm&sid1=101&sid2=261&oid=001&aid=0011993637
20201105 오전 6:46,101,261,SK이노가 LG화학에 낸 美특허소송 1년 뒤에야 최종판결,LG화학에서 분사하는 신설법인이 소송 승계 아시아경제 박소연 기자 SK이노베이션이 LG화학을 상대로 미국 국제무역위원회 ITC 에 제기한 특허침해 소송의 최종 판결 기일이 내년 11월 30일로 정해졌다.이 소송은 다음 달 1일 LG화학에서 분사하는 배터리 사업부문 신설법인 LG에너지솔루션 가칭 이 승계할 전망이다.5일 업계에 따르면 최근 ITC는 SK이노베이션이 자사의 배터리 특허 기술 994 특허 을 침해했다며 LG화학을 상대로 제기한 특허소송의 최종 판결 기일을 내년 11월 30일로 잡았다.ITC 소송 당사자들이 각자의 주장과 상대측 주장에 대한 반론을 펼치는 변론 Hearing 기일은 내년 3월 15∼19일 닷새 동안 진행된다.위원회의 최종판결 전 ITC 행정판사가 예비결정을 내리는 기일은 내년 7월 30일이다. 특허 소송에서는 ITC 행정판사의 예비결정 가운데 약 90％가 ITC 위원회 최종결정에서도 유지된다.앞서 LG화학은 지난해 4월 먼저 SK이노베이션이 자사의 배터리 핵심 인력을 빼가 영업 비밀을 침해했다며 ITC와 미국 델라웨어 지방법원에 소송을 제기했다.같은 해 9월 SK이노베이션은 자사의 994 특허를 침해하는 배터리 제품을 LG화학이 미국에서 팔고 있다며 ITC에 특허소송을 제기했고 LG화학은 오히려 SK이노베이션이 특허를 침해했다며 ITC에 추가 소송을 제기했다.ITC는 LG화학이 처음 제기했던 영업비밀 침해 소송에 대해 내달 10일 최종 판결을 내릴 예정이다. ITC는 올해 2월 SK이노베이션에 조기 패소 예비결정을 내렸다.SK이노베이션이 LG화학을 상대로 제기한 특허소송은 내년 11월 30일 반대로 LG화학이 SK이노베이션을 상대로 제기한 특허소송은 내년 7월 19일 최종 판결이 나올 예정이다.LG화학의 배터리 사업 부문 분사에 따라 LG화학이 그간 소송 당사자로 참여해온 배터리 기술 영업비밀·특허소송은 내달 1일 출범하는 LG에너지솔루션 가칭 이 승계할 전망이다.최근 LG화학 임시 주주총회에 통과된 분할계획서 승인 안건에 따르면 LG화학의 배터리 사업 부문과 관련된 일체 소송은 원칙적으로 독립하는 신설법인에 귀속된다.이에 따라 LG 측이 이번 ITC 소송에서 패소할 경우 그에 따른 부담도 신설법인에 돌아가게 된다.LG화학 관계자는 ITC를 비롯해 배터리 사업 관련 소송은 분사 이후 신설 법인이 승계하는 것이 원칙 이라며 미국 현지의 법적 이슈와 충돌하는 것은 없는지 세부 내용을 검토하고 있다 고 설명했다.,https://news.naver.com/main/read.nhn?mode=LS2D&mid=shm&sid1=101&sid2=261&oid=277&aid=0004785997
20201105 오전 3:06,101,261,LG화학 노사 마을회관에 태양광 발전설비 기증,4일 충남 서산시 대산공장 인근 마을회관에서 열린 태양광 발전설비 기증식 후 LG화학 신학철 부회장 왼쪽에서 다섯번째 을 비롯한 LG화학 노사 대표자들이 기념사진을 찍고 있다. LG화학 제공 LG화학 노사는 충남 서산시 대산공장 인근에 있는 기은2리 마을회관에 태양광 발전설비를 기증했다고 4일 밝혔다. 지역사회 복지시설의 에너지비용 절감을 지원하기 위한 차원이다. 이날 기증식에는 LG화학 신학철 부회장과 송호섭 대산노동조합위원장 최고인사책임자 CHO 김성민 전무 대산공장 주재임원 김동온 상무 등 노사 대표자들이 참석했다. 이번 태양광 발전설비 설치로 기은2리 마을회관은 연간 7000㎾ 이상의 전력을 절감할 수 있게 됐다고 LG화학은 설명했다. 지난해 한 가구당 연평균 전력 사용량이 약 3500㎾임을 고려하면 마을회관에 필요한 전력 전량을 대체 가능한 수준이다. LG화학은 대산공장을 시작으로 올해 연말까지 오창 익산 등 사업장 인근 지자체로부터 추천받은 복지시설 4곳에도 추가적으로 태양광 발전설비를 기증할 계획이다. 신학철 LG화학 부회장은 “기업시민으로서 지속가능한 환경 조성에 기여하기 위해 지역사회 에너지 복지 활동에 적극 나서겠다”고 말했다. LG화학 노사는 ‘그린케미 프로젝트’ 일환으로 코로나19 극복 위한 임직원 만원의 나눔 임직원 릴레이 헌혈 캠페인 특별재난지역 수재민 돕기 모금 활동 등을 실시하고 있다.,https://news.naver.com/main/read.nhn?mode=LS2D&mid=shm&sid1=101&sid2=261&oid=022&aid=0003520044
20201106 오후 5:21,101,261,美 ITC LG화학·SK이노에 녹취록 추가 제출 요구... 배경은,최종 결정에 변수 통상적 검토 절차 전기차 배터리 소송전을 벌이고 있는 LG화학과 SK이노베이션의 그룹 로고. 한국일보 자료사진LG화학이 SK이노베이션을 상대로 제기한 영업비밀 침해 소송을 심리 중인 미국 국제무역위원회 ITC 가 양사에 포드와 폭스바겐을 인터뷰한 녹취록 제출을 추가로 요청했다. 포드와 폭스바겐은 그간 ITC에 제출한 탄원서를 통해 SK이노베이션의 조기 패소 결정에 반대 의견을 밝혀온 기업들이다. 앞서 ITC는 올해 2월 SK이노베이션에 조기 패소 판결을 내렸고 SK이노베이션은 이의를 신청했다. 이번 소송의 최종 결정일은 지난 10월 5일에서 26일로 연기됐다가 다시 12월 10일로 미뤄진 상태다.6일 ITC 홈페이지에 따르면 ITC는 지난달 30일 LG화학과 SK이노베이션에 양사 변호인이 포드와 폭스바겐을 상대로 진행했던 심문 녹취록 제출을 요구했다. 이에 LG화학이 양사 녹취록 자료를 받아 ITC에 제출했다.ITC가 최종 결정을 앞두고 포드와 폭스바겐의 녹취록을 요구한 배경에 관심이 쏠린다.포드는 미국 내 생산 전기트럭 F시리즈 폭스바겐은 미국 내 생산하는 전기차 배터리의 대부분을 현재 SK이노베이션이 짓고 있는 미국 조지아주 공장에서 조달할 예정이다. 이 때문에 포드는 지난 5월 ITC에 제출한 탄원서에서 LG화학은 F 150 전기차에 대한 대체 배터리를 공급할 수 없다 며 ITC의 SK이노베이션에 대한 조기 패소 결정은 미국 경제 전체와 공익 보건 복지 등에 영향을 미칠 것 이라며 반대 의견을 냈다. 폭스바겐 역시 SK이노베이션과 폭스바겐이 맺은 계약이 파괴된다면 고임금 일자리를 원하는 미국의 노동자들과 전기차를 원하는 소비자들에 피해가 간다 고 주장했다.이에 따라 SK측은 현재 ITC가 심문 내용을 다시 검토하는 것이 최종 결정에 변수가 될 만한 것인지 촉각을 곤두세우고 있다.반면 신종 코로나바이러스 감염증 코로나19 으로 연기됐던 자료 검토를 위해 추가 제출을 요구한 것일 뿐 특별한 의미를 부여할 필요는 없다는 의견도 있다.LG화학 측은 앞서 ITC에 제출했던 녹취록은 일부이고 이번에 전체 내용을 제출하라고 한 것 이라며 통상적인 ITC 활동의 일환일 뿐 결과에 영향을 미칠 만한 사안은 아니다 라고 말했다.,https://news.naver.com/main/read.nhn?mode=LS2D&mid=shm&sid1=101&sid2=261&oid=469&aid=0000551513
20201106 오후 4:53,101,261,포드·폭스바겐 녹취록 제출하라…美 ITC LG화학·SK이노에 요구,SK 최종판결 영향 주나 촉각LG 통상적인 절차일 뿐 미국 국제무역위원회 ITC 가 LG화학과 SK이노베이션에 전기차 배터리 영업비밀 침해 소송과 관련해 미국 포드와 독일 폭스바겐을 인터뷰한 녹취록을 제출하라고 요청했다. 내달 10일로 연기된 ITC의 최종 판결에 변수가 될지 주목된다.6일 업계에 따르면 ITC는 지난달 30일 LG와 SK 측 변호인이 포드와 폭스바겐을 상대로 진행했던 심문 녹취록 제출을 요구했다. LG는 양측 변호인을 대신해 2019년 10월 24일 폭스바겐 녹취록과 같은 해 11월 8일 포드의 심문 녹취록을 ITC에 제출했다.포드와 폭스바겐은 SK가 패소하면 미국 내 전기차 생산이 차질을 빚을 수 있다며 우려를 나타낸 바 있다. 포드는 전기트럭 F시리즈 폭스바겐은 미국에서 생산하는 전기차 배터리 대부분을 SK 미국 조지아주 공장에서 조달할 예정이다.ITC의 SK 조기 패소 결정이 최종 판결에서 확정되면 SK의 미국 공장 가동이 어려워진다. 폭스바겐과 포드는 지난 5월 ITC에 “한국 배터리 제조사들 간 분쟁이 부품 공급 중단과 미국의 일자리 감소로 이어질 수 있다”는 내용의 탄원서를 제출했다.SK 측은 ITC가 심문 내용을 다시 살펴보는 것이 최종 결정에 변수가 될지 촉각을 곤두세우고 있다. LG 측은 그러나 “앞서 녹취록 일부를 제출했으며 이번엔 전체 내용을 내라고 한 것”이라며 “통상적인 절차로 판결에 영향을 미칠 만한 사안은 아니다”고 밝혔다.ITC가 예정대로 내달 10일 최종 결정을 내릴지는 미지수다. 미국이 대선으로 혼란스러운 상황인 데다 신종 코로나바이러스 감염증 코로나19 재확산세가 심상치 않아 추가 연기 가능성도 있는 것으로 업계는 보고 있다.,https://news.naver.com/main/read.nhn?mode=LS2D&mid=shm&sid1=101&sid2=261&oid=015&aid=0004445278
20201106 오후 4:05,101,261,LG화학GM 전기차 배터리 합작사… 미국서 1000여명 인력 채용,LG화학과 미국 제너럴모터스 GM 의 합작법인이 대규모 인력 채용에 나섰다 사진 로이터LG화학과 미국 제너럴모터스 GM 의 합작법인이 미국 현지에서 1000여명의 대규모 인력 채용을 시작했다.6일 업계에 따르면 양사의 합작법인 얼티엄 셀즈 UltiumCellsLLC 는 최근 채용공고를 내고 새 합작법인에서 근무할 약 1100명 규모의 신규 인력을 채용키로 했다. 채용 분야는 공정 엔지니어 정보기술 전문가 구매 분석 전문가 품질 분석 엔지니어 등 14개 직군이다.LG화학과GM은 지난해 12월 2조7000억원을 들여 전기차 배터리 공장을 짓기로 합의했다.GM은 배터리를 안정적으로 공급받고LG화학은 미국 자동차 업체인GM을 고객사로 확보하는 양사 이해관계가 일치해 추진됐다. 합작사는 50대 50 지분으로LG화학과GM이 각각 1조원을 출자해 설립됐다. 양사는 단계적으로 총 2조7000억원을 투자 연간 30GWh이상 생산능력을 확보한다는 구상이다. 공장은 미국 오하이오주 로즈타운 지역에 들어선다. 완공은 2022 2023년이 목표다. 이 공장에서 양산된 배터리셀은 GM의 차세대 전기차에 공급된다.,https://news.naver.com/main/read.nhn?mode=LS2D&mid=shm&sid1=101&sid2=261&oid=417&aid=0000615630
