20201120 오후 4:48,100,267,신속통로 중단 우려 속 LG화학 전세기 중국 난징으로 출국,중국 향하는 기업인들 영종도 연합뉴스 서명곤 기자 5월 10일 삼성디스플레이 삼성전기 직원들이 기업인 신속통로를 통해 중국 텐진으로 출국하기 위해 탑승 수속을 하고 있다. 연합뉴스 자료사진 서울 연합뉴스 김철선 기자 중국이 신종 코로나바이러스 감염증 코로나19 재확산에 자국 입국 절차를 강화하는 가운데 LG화학 직원들을 태운 전세기가 20일 중국으로 출국했다. LG화학은 자사 배터리 분야 엔지니어 등 직원 100여 명을 태운 전세기가 이날 인천공항을 통해 중국 난징 南京 으로 출국했다고 밝혔다. 난징에는 LG화학의 전기차 배터리 공장이 있는데 LG화학은 공장 운영을 위해 입국시 격리를 면제해주는 기업인 신속통로 패스트트랙 제도를 이용해 출국했다. 배터리 업계에 따르면 최근 중국 정부는 LG화학에 추가적인 전세기 입국 신청을 받지 않겠다 는 입장을 전한 것으로 전해졌다. 이날 출국한 LG화학 전세기는 중국 정부가 이 같은 입장을 밝히기 전 중국 입국을 신청해 허가받은 것으로 알려졌다. 앞서 삼성전자와 협력사 직원들을 태우고 지난 13일 중국으로 출국할 예정이었던 전세기 2편은 중국 정부의 입국 불허로 취소됐다. 이를 두고 업계에서는 중국 정부가 코로나19 재확산에 따라 기업인 신속통로 제도를 중단하는 것이 아니냐는 우려가 나왔지만 한중 양국 정부는 신속통로 제도를 변함없이 계속 운영한다고 밝혔다. 싱하이밍 邢海明 주한 중국대사는 전날 서울 광화문 포시즌스호텔에서 열린 2020 한중 우호 청년포럼 에 참석해 신속통로가 힘들다는데 그것은 사실이 아니다 며 신속 통로는 계속하고 방역은 방역대로 계속할 것 이라고 말했다.,https://news.naver.com/main/read.nhn?mode=LS2D&mid=shm&sid1=100&sid2=267&oid=001&aid=0012029478
20201102 오후 6:18,101,258,그린뉴딜에 뜨는 삼성SDI 분할에 지는 LG화학,지난 9월 분할 발표 후 LG화학 14.2%↓같은 기간 코스피 5.8% 하락 삼성SDI는 2.7%↓개인투자자 이날만 삼성SDI 409억원 어치 순매수 이데일리 유준하 기자 양대 2차전지주에 대한 투자심리가 엇갈리고 있다. 삼성SDI는 친환경 기조에 따른 미국 에너지저장장치 ESS 시장 성장에 그린뉴딜 수혜주로 꼽히면서 완만한 상승세를 보이고 있는 반면 LG화학은 지난 9월 배터리 사업부 분할 발표 이후 내리막길을 걷고 있다. 그래픽 이데일리 김다은2일 마켓포인트에 따르면 LG화학 051910 은 배터리 사업 분할결정을 발표한 9월15일 전날 종가에 비해 이날까지 12.5% 하락했다. 반면 삼성SDI 006400 는 0.92% 상승했다. 이 기간 코스피지수가 5.2% 하락한 것과 비교하면 삼성SDI는 선방했고 LG화학은 시장수익률을 하회한 것이다. 이에 따라 올해 하반기들어 배터리 사업 성장성에 연일 신고가를 갈아치우며 시가총액 4위까지 올랐던 LG화학은 9월 한때 6위까지 밀렸다가 5위를 겨우 회복한 상태고 삼성SDI는 10위에서 9위로 한계단 올라섰다. 삼성SDI가 코스피지수 하락에도 선방한 것은 전기차 배터리가 ESS로 재활용이 가능하다는 점에서 그린뉴딜 수혜를 받을 것이라는 분석 덕이다. 삼성SDI는 컨퍼런스콜에서 내년 해외 ESS 시장 수요가 30 40% 증가할 것이란 전망과 함께 미주 전력용 시장이 이를 주도할 것으로 예상되는 만큼 해외 수주 노력을 지속하겠다는 계획을 밝히기도 했다. 노경탁 유진투자증권 연구원은 “3분기 호실적에 이어 유럽 전기차 보급 확대 및 미주 ESS 프로젝트 가동으로 중대형 배터리 공급이 크게 증가하면서 전세계적 그린 뉴딜 트렌드의 핵심적 기업이 될 것으로 기대한다”고 설명했다.반면 LG화학의 경우 배터리 지분에 대한 희석 우려로 최근 조정양상을 보였다. 배터리 분할 계획을 발표한 당일 5.37% 이튿날 6.11% 급락했고 임시 주주총회에서 분할안이 통과된 지난달 30일에도 6% 넘게 미끄러졌다. 현대자동차 코나EV 화재 논란도 LG화학에게는 넘어야 할 악재다. 코나 EV 화재 사고 원인에 대해 국토교통부는 배터리 셀 제조불량 가능성을 지목한 반면 LG화학은 제조 결함 가능성을 부인하고 있다.업계 관계자는 “아직 조사 결과가 나오려면 멀었기 때문에 조심스러운 입장이다”라면서 “화재원인을 남아 있는 재로 분석하는 것이기에 조사 결과에 상당한 시일이 걸릴 것”이라고 말했다.,https://news.naver.com/main/read.nhn?mode=LS2D&mid=shm&sid1=101&sid2=258&oid=018&aid=0004775676
20201102 오후 5:52,101,258,장중 60만원도 깨졌다…LG화학에 등돌린 동학개미 박해린의 뉴스마켓,동영상 뉴스 한국경제TV 박해린 기자 앵커 72만원까지 치솟았던 LG화학 주가가 오늘 개장과 함께 58만원선까지 밀렸습니다.왜 이렇게 주가가 떨어지는 건가요 기자 일단 개인 투자자들은 LG화학에 대해 등을 돌린듯한 모습입니다.지난 9월 17일 분사 소식이 전해지자마자 청와대 국민청원 게시판은 물론이고 각종 주식 커뮤니티에선 불만 글이 쏟아져 나오기도 했고요.지난주 금요일이였죠.주총장에 제가 잠시 다녀왔는데요.개인 투자자들은 다소 격양돼 있는 모습을 보이기도 하고. 안건 통과 소식이 전해지자 살벌한 분위기까지 감지됐습니다.일단 이렇듯 등 돌린 개인투자자들의 물량이 계속해서 나오고 있고 기관투자자들의 매도도 이어지면서 주가가 계속해서 하락하고 있습니다. 앵커 증권업계와 개인 투자자들의 시각이 엇갈리고 있다던데 왜 이런 차이가 나타나는 건가요 기자 네. 앞서 말씀드린 바와 같이 개인투자자들은 일단 LG화학의 배터리 사업 부분이 분사한다면 앙꼬 없는 찐빵 과 다르지 않냐는 시각입니다.또 분할 회사 에너지솔루션이 상장을 하게 된다면 배터리 분야에 투자하고 싶은 사람은 이 회사에 투자하지 굳이 모회사인 LG화학에 투자할 이유가 없다 라고 보며 주가 하락은 불 보듯 뻔하다 라고 보고 있고요.반면 증권업계는 일단 물적 분할이 가져올 가치를 굉장히 크게 환산하고 있습니다.그동안 LG화학이란 회사는 배터리 사업이 아무리 잘나가도 화학 분야 때문에 오히려 시장에서 가치가 낮게 평가돼왔거든요예를 들어 중국 CATL이란 회사가 있습니다. 글로벌 전기차 시장에서 따져보면 LG화학이 1위고 CATL이 2위거든요 근데 시총은 CATL이 약 78조원 정도고. LG화학은 48조원 이 중 배터리 사업부 가치는 약 38조원정도로 추산되고 있는데.분할해서 딱 떼놓고 경쟁을 시켜보면 적어도 CATL의 시총 정도는 따라잡지 않겠냐 라는 시각으로 물적 분할에 대해 굉장히 긍정적으로 보고 있습니다.결론적으론 회사의 먼 미래를 보고 투자하는 경우와 마냥 기다릴 수만은 없는 개인 투자자의 입장 차이가 발생하는 겁니다. 앵커 주가는 그럼 언제까지 떨어지는 겁니까. 향후 전망은 어떻습니까. 기자 일단 두 가지로 정리해볼 수 있겠습니다.물적 분할만 놓고 본다면 개인 매물뿐만 아니라 앞으로 기관의 매물이 더 나올 수 있단 우려가 있습니다.LG화학의 2대 주주인 국민연금은 주총을 이틀 앞두고 주주 가치 훼손을 이유로 분할안에 대해 반대 입장을 밝혔는데요.국민연금 측에선 자신들의 반대에도 불구하고 분할안이 가결됐기 때문에 향후 보유 비중을 축소할 수 있겠죠.또 익명을 요청한 한 애널리스트는 사실 우리가 물적 분할에 모든 관심이 꽂혀있지만 더 큰 문제는 현대차 코나EV 화재에 따른 리스크다 라고 보더라고요.현대차 측에선 화재의 원인이 LG화학의 배터리셀 문제다 라고 보고 있는 상황인데 최근 삼성SDI가 현대차 배터리 사업 입찰에 이례적으로 참여했거든요.따라서 업계에선 LG화학의 자리를 삼성SDI가 꿰차면 추가적인 주가 하락이 예상된다 라고 보고 있습니다. 앵커 네 박찬휘 캐스터와 함께 주가 흐름 살펴보시죠. 앵커 지금까지 박해린 증권부 기자 박찬휘 캐스터와 함께 했습니다.저희는 내일 이시간에도 함께 하겠습니다.,https://news.naver.com/main/read.nhn?mode=LS2D&mid=shm&sid1=101&sid2=258&oid=215&aid=0000912312
20201102 오후 4:41,101,258,TF매매동향 외국인 LG화학 사고 삼성SDI 팔았다,2일 코스피와 코스닥은 외인과 기관 매수에 강세 마감했다. 더팩트 DBLG화학 672억 원 매수·삼성SDI 404억 원 매도 더팩트ㅣ박경현 기자 2일 코스피와 코스닥은 외인과 기관 매수에 강세 마감했다. 유가증권시장에서 외국인은 490억 원 기관은 487억 원을 각각 사들인 가운데 개인 홀로 1076억 원을 팔아치웠다.코스닥에서는 외국인과 기관이 각각 1198억 원 89억 원을 순매수 했고 개인 홀로 1147억 원을 순매도 했다.외국인투자자의 코스피시장 최대매수는 LG화학으로 향했다. 외인은 LG화학 672억 원 신한지주 204억 원 현대차 180억 원 하나금융지주 161억 원 한화솔루션 159억 원을 사들였다.반면 삼성SDI는 404억 원을 팔았다. 이어 SK하이닉스 379억 원 삼성전자 244억 원 롯데케미칼 228억 원 순으로 순매도했다.코스닥시장에서는 아프리카TV 72억 원 제넥신 67억 원 웹젠 51억 원 을 사고 미코 28억 원 바이넥스 18억 원 웰크론 17억 원 은 팔았다.외국인투자자의 코스피시장 최대매수는 LG화학으로 향했다. 외인은 LG화학 672억 원 신한지주 204억 원 현대차 180억 원 하나금융지주 161억 원 한화솔루션 159억 원을 사들였다. 한국거래소 제공기관투자자는 신한지주에 256억 원을 사들였다. 또한 롯데케미칼 220억 원 현대차 164억 원 KB금융 153억 원 순으로 매수했다.반면 삼성전자는 467억 원을 팔아치웠다. 또한 네이버 393억 원 LG화학 306억 원 현대모비스 127억 원을 순매도했다.시가총액 상위종목은 대부분 올랐다. 삼성전자 1.41% 삼성바이오로직스 2.35% LG화학 1.96% 삼성전자우 2.20% 현대차 3.65% 셀트리온 1.45% 카카오 1.36% 가 상승했고 SK하이닉스 0.38% 네이버 1.55% 삼성SDI 0.45% 가 내렸다.,https://news.naver.com/main/read.nhn?mode=LS2D&mid=shm&sid1=101&sid2=258&oid=629&aid=0000049957
20201102 오후 4:16,101,258,특징주LG화학 배터리 물적분할에도 반등…바이든 덕분,머니투데이 김소연 기자 LG화학이 하루만에 반등했다. 배터리 물적분할 안건이 통과되면서 장중 약세를 보였지만 미국 대선을 앞두고 정책 수혜 기대감 속 상승 마감했다. 2일 LG화학은 전일대비 1만2000원 1.96% 오른 62만3000원에 마감했다. 하루만에 반등했지만 장중 3.76% 떨어진 58만8000원을 찍기도 했다. 전 거래일인 지난달 30일에는 6.14% 하락하기도 했다. LG화학은 지난달 30일 임시주주총회를 열어 배터리사업부문 물적분할을 가결했다. LG화학 2대주주인 국민연금이 물적분할 안건에 반대의견을 보이면서 치열한 표 대결이 예상됐지만 원안이 무난히 통과됐다. 이에 따라 오는 12월1일 배터리 사업을 전담하는 신설법인인 ‘LG에너지솔루션 가칭 ’이 공식 출범할 예정이다. LG화학은 신설법인의 지분 100%를 가진다. 추후 해당 기업을 상장할 계획이다. 앞서 소액주주들은 물적분할 방식이 배터리 사업 신설법인의 주식을 보유할 수 없다는 이유로 물적분할 대신 인적분할을 선택할 것을 요구해왔다. 국민연금이 소액주주 편을 들었지만 결국 원안대로 통과됐다. 이에 이날 LG화학은 오전 중 약세를 면치 못했다. 그러나 오후 들어 미국 대선 11월3일 기대감 속 주가가 반등했다. 조 바이든 민주당 후보의 승리를 점친 외국인들이 LG화학을 11만주 가량 순매수한 영향으로 풀이된다. 바이든 후보는 대선 공약으로 친환경 정책을 내걸었다. △전력부문 탄소배출 2035년 제로 △캘리포니아식 연비규제 △친환경차 산업 집중 투자 △2050년 탄소배출 제로 등이다. LG화학은 전기차 배터리를 생산하기 때문에 바이든 당선시 수혜가 기대된다.,https://news.naver.com/main/read.nhn?mode=LS2D&mid=shm&sid1=101&sid2=258&oid=008&aid=0004493637
20201102 오전 11:27,101,258,LG화학 ‘배터리 분리’ 후폭풍…석달 만에 60만원 밑으로,물적분할 따른 개인 실망감 매도증권가 대부분 목표가 유지·상향“석화 실적개선 등 호재많다” 의견LG화학 주가가 석 달 만에 60만원선이 붕괴되는 등 배터리 사업부 분할에 따른 후폭풍이 이어지고 있다.2일 유가증권시장에서 LG화학은 전 거래일보다 2000원 0.33% 내린 60만9000원으로 출발한 뒤 반짝 반등세를 보였으나 이내 60만원선이 무너졌다. LG화학 주가가 60만원 밑으로 떨어진 건 지난 8월 3일 최저 57만7000원 이후 석 달 만이다. 앞서 지난 30일 주주총회에서 배터리 사업을 물적분할하는 안건이 통과되자 6.14% 하락한 바 있다.LG화학의 주가 부진에는 배터리 산업 성장성에 투자했던 개미들의 실망감이 원인으로 꼽힌다. 분할 관련 이사회가 열린 9월 17일부터 지난달 30일까지 개인투자자가 순매도한 LG화학 주식은 8892억원 어치에 달한다.다만 증권가에서는 LG화학의 주가 반등 가능성을 높게 점치고 있다. 금융정보업체 에프앤가이드에 따르면 지난달 LG화학 보고서를 낸 증권사 18곳 중 16곳이 목표주가를 유지하거나 상향했다.목표주가를 내린 삼성증권과 유안타증권도 배터리 화재 관련 불확실성을 문제 삼았었다.NH투자증권 황유식 연구원은 “석유화학 사업을 중심으로 한 영업실적 개선 전지부문 분사에 따른 대규모 자금 확보 기반 마련 중대형 전지에 대한 집중투자를 통한 성장이 가능하다”며 목표주가를 75만원에서 85만원으로 올렸다.김정현 교보증권 연구원은 “분할 이후 회사가 공언했던 생명과학·첨단소재의 성장성이 부각될 것으로 판단한다. 통풍치료제 만성염증질환 치료제 미국 희귀의약품으로 지정된 경구용 비만치료제 등 기업가치를 높일 신약 후보물질이 다수 있다”며 “최근 주가 하락은 글로벌 1위 전지기업이자 종합화학기업 LG화학을 매수할 길지 않을 기회”라고 분석했다.,https://news.naver.com/main/read.nhn?mode=LS2D&mid=shm&sid1=101&sid2=258&oid=016&aid=0001745928
20201102 오전 10:17,101,258,TF특징주 LG화학 배터리 물적분할에 60만 원 붕괴,LG화학 주가가 2일 장초반 하락세를 보이고 있다. 주가는 지난달 30일 임시 주주총회에서 의결된 배터리 사업부문 분할안에 영향을 받고 있는 것으로 풀이된다. 더팩트DB지난달 30일 이어 이틀 연속 하락세 더팩트ㅣ정소양 기자 LG화학 주가가 배터리사업부문의 물적분할 결정에 거래일 기준 2일 연속 하락세를 보이고 있다. 특히 주가는 한 때 60만 원 아래로 떨어지기도 했다. LG화학 주가가 60만 원 아래로 떨어진 것은 지난 7월 말 이후 3개월여 만이다.2일 오전 10시 8분 기준 LG화학 주가는 전일 대비 1만1000원 1.80% 하락한 60만 원에 거래되고 있다. 한 때 주가는 58만8000원까지 떨어지기도 했다. LG화학 주가가 종가 기준 60만 원 아래로 떨어진 것은 지난 7월 31일 56만8000원 이 마지막이었다.같은 시각 LG화학우선주도 전장 대비 3.39% 1만500원 하락한 29만9500원에 거래 중이다.앞서 지난달 30일 LG화학은 임시 주주총회에서 배터리 사업부문 분할안이 의결됐다고 밝혔다. 해당 소식이 전해지자 당시 LG화학 주가는 6% 넘게 하락했다.이날 주가 하락세 역시 배터리사업부문의 물적분할 결정에 영향을 받고 있는 것으로 보인다.한편 분사 안건이 가결되면서 오는 12월 1일 배터리 사업을 전담하는 신설법인인 LG에너지솔루션 가칭 이 공식 출범할 예정이다. LG화학은 신설법인의 지분 100%를 가지게 된다. 분할등기 예정일은 12월 3일이다. 분할 회사는 LG화학의 100% 자회사이며 자본금 1000억 원의 회사로 설립된다.,https://news.naver.com/main/read.nhn?mode=LS2D&mid=shm&sid1=101&sid2=258&oid=629&aid=0000049814
20201102 오전 9:58,101,258,코스피 美 대선 앞두고 소폭 상승…LG화학 60만원선 깨져,사진 게티이미지뱅크 코스피지수가 상승하고 있다.2일 오전 9시52분 현재 코스피지수는 전날보다 18.72포인트 0.80% 상승한 2285.39에 거래되고 있다.코스피는 지난주 마지막 거래일 3% 가까이 하락했는데 이에 따른 반발 매수세가 유입된 것이 지수를 밀어올리는 것으로 해석된다. 개인은 124억원 팔고 있는 반면 외국인은 2억원 기관은 106억원 사들이고 있다. 프로그램 매매는 차익거래가 63억원 순매수 비차익거래가 179억원 순매도로 총 115억원 매도 우위를 나타내고 있다. LG화학은 장중 60만원선이 무너졌다. LG화학은 전날보다 9000원 1.47% 떨어진 60만2000원에 거래되고 있다. 장중에는 58만8000원까지 하락하면서 60만원선을 내줬다. 지난달 30일 배터리 사업부문 물적 분할을 확정한 이후 2거래일 연속 하락하는 모양새다.은행주가 강세를 보이고 있다. DGB금융지주는 전날보다 290원 4.69% 뛴 6470원에 거래 중이다. KB금융지주 신한지주 하나금융지주 KB금융 기업은행 우리금융지주 BNK금융지주 등도 1 3%대로 강세다. 3분기 호실적에 더해 연말 배당 기대감이 주가를 밀어올리는 것으로 풀이된다.코스닥지수도 소폭 강세다. 코스닥은 같은 시간 5.38포인트 0.68% 상승한 798.03에 거래되고 있다. 장중 800선을 다시 회복하기도 했지만 상승 폭을 일부 반납한 상황이다.원·달러 환율은 상승 원화 가치 약세 하고 있다. 서울외환시장에서 원·달러 환율은 전날보다 0.7원원 오른 1135.8원에 거래되고 있다. 지난달 28일부터 3거래일 연속 1130원대를 유지하고 있다.,https://news.naver.com/main/read.nhn?mode=LS2D&mid=shm&sid1=101&sid2=258&oid=015&aid=0004441760
20201102 오전 9:41,101,258,LG화학 분할 후폭풍 지속…60만원선 붕괴,물적분할 따른 개미 실망감증권가 목표주가 유지·상향…85만원대“석화 실적개선…생명과학·첨단소재 성장성 부각”LG화학이 주주총회에서 물적분할을 확정한 여파로 2일 장중 주가 60만원선이 무너졌다. 연합 헤럴드경제 강승연 기자 LG화학 주가가 석 달 만에 60만원선이 붕괴되는 등 배터리 사업부 분할에 따른 후폭풍이 이어지고 있다.2일 유가증권시장에서 LG화학은 전 거래일보다 2000원 0.33% 내린 60만9000원으로 출발한 뒤 반짝 반등세를 보였으나 이내 60만원선이 무너졌다. LG화학 주가가 60만원 밑으로 떨어진 건 지난 8월 3일 최저 57만7000원 이후 석 달 만이다. 앞서 지난 30일 주주총회에서 배터리 사업을 물적분할하는 안건이 통과되자 6.14% 하락한 바 있다.LG화학의 주가 부진에는 배터리 산업 성장성에 투자했던 개미들의 실망감이 원인으로 꼽힌다. 분할 관련 이사회가 열린 9월 17일부터 지난달 30일까지 개인투자자가 순매도한 LG화학 주식은 8892억원 어치에 달한다.다만 증권가에서는 LG화학의 주가 반등 가능성을 높게 점치고 있다. 금융정보업체 에프앤가이드에 따르면 지난달 LG화학 보고서를 낸 증권사 18곳 중 16곳이 목표주가를 유지하거나 상향했다. 목표주가를 내린 삼성증권과 유안타증권도 배터리 화재 관련 불확실성을 문제 삼았었다.NH투자증권 황유식 연구원은 “석유화학 사업을 중심으로 한 영업실적 개선 전지부문 분사에 따른 대규모 자금 확보 기반 마련 중대형 전지에 대한 집중투자를 통한 성장이 가능하다”며 목표주가를 75만원에서 85만원으로 올렸다.김정현 교보증권 연구원은 “분할 이후 회사가 공언했던 생명과학·첨단소재의 성장성이 부각될 것으로 판단한다. 통풍치료제 만성염증질환 치료제 미국 희귀의약품으로 지정된 경구용 비만치료제 등 기업가치를 높일 신약 후보물질이 다수 있다”며 “최근 주가 하락은 글로벌 1위 전지기업이자 종합화학기업 LG화학을 매수할 길지 않을 기회”라고 분석했다.,https://news.naver.com/main/read.nhn?mode=LS2D&mid=shm&sid1=101&sid2=258&oid=016&aid=0001745698
20201102 오전 9:29,101,258,특징주 배터리 떼어내는 LG화학 60만원 아래로…약 3개월만,30일 서울 여의도 트윈타워에서 LG화학 임시주주총회가 열리고 있다. LG화학의 배터리사업 분할안건은 참석 주식 총수의 82.3%와 의결권 있는 발행주식 총수의 63.7%의 찬성으로 통과됐다. LG화학 제공 2020.10.30 뉴스1 서울 뉴스1 정은지 기자 LG화학 주가가 3%대 하락하며 60만원 아래로 떨어졌다. 전기차배터리 대장주인 LG화학 주가가 60만원 아래로 떨어진 것은 지난 7월 말 이후 3개월여 만이다. 2일 오전 9시 23분 기준 LG화학 주가는 전일 대비 1만9000원 3.11% 하락한 59만2000원에 거래되고 있다. LG화학 주가가 종가 기준 60만원 아래로 떨어진 것은 지난 7월 31일 56만8000원 이 마지막이었다.앞서 LG화학 주가는 배터리사업부문의 물적분할이 결정된 지난달 30일 6% 넘게 하락했다. 개인들은 배터리 사업을 보고 LG화학을 샀기 때문에 배터리 사업 신설법인의 주식을 보유할 수 있는 인적분할 방식이 돼야 한다고 반발해 왔다. 국민연금은 주주가치 훼손 가능성이 있다며 물적분할안에 반대하기로 결정한 바 있다. 분사 안건이 가결되면서 오는 12월1일 배터리 사업을 전담하는 신설법인인 LG에너지솔루션 가칭 이 공식 출범할 예정이다. LG화학은 신설법인의 지분 100%를 가지게 된다.,https://news.naver.com/main/read.nhn?mode=LS2D&mid=shm&sid1=101&sid2=258&oid=421&aid=0004964163
20201102 오전 9:35,101,258,LG화학 분할안 주총 통과에 60만원 밑으로,머니투데이 정인지 기자 특징주 LG화학이 2거래일 연속 하락하며 60만원을 밑돌고 있다. 2일 오전 9시32분 현재 LG화학은 전 거래일 대비 2.29% 떨어진 59만7000원을 기록하고 있다. LG화학은 전 거래일인 지난달 30일 배터리 사업부 물적분할안을 주주총회에서 통과시켰다. 당일 LG화학 주가는 6.14% 빠졌다. 이날도 약세를 보이면서 주가는 60만원을 밑돌고 있다. LG화학 주가가 60만원을 밑돈 것은 종가 기준 지난 7월 말 이후 처음이다.,https://news.naver.com/main/read.nhn?mode=LS2D&mid=shm&sid1=101&sid2=258&oid=008&aid=0004493272
20201102 오전 9:37,101,258,특징주 배터리 물적분할에 60만원선 무너진 LG화학,지난달 30일 배터리부문 물적분할 확정 후2거래일째 큰 폭의 하락세 이어져7월 말 이후 4개월만에 60만원선 붕괴신학철 LG화학 부회장이 30일 오전 서울 여의도 LG트윈타워 동관에서 열린 LG화학 주주총회에서 인사말을 하고 있다. 사진 LG화학 서울경제 지난달 30일 LG화학 051910 의 배터리 사업부문 물적 분할이 확정된 후 LG화학 주가가 2거래일째 하락세를 면치 못하고 있다. 반대 의견을 고수했던 개인 투자자들의 실망 매도가 이어지면서 LG화학의 주가는 60만원선 아래로 무너졌다.2일 한국거래소에 따르면 이날 9시 30분 기준 LG화학은 전거래일보다 2.29% 1만4 000원 하락한 59만7 000원에 거래되고 있다. LG화학의 주가가 60만원 아래로 떨어진 것은 7월 말 이후 4개월 만이다. 이날 LG화학은 장 초반 전거래일 대비 3.75% 하락해 58만8 000원까지 하락하며 신저가를 기록하기도 했다. 증권가는 LG화학의 하락세가 개인 투자자들의 실망 매도에 의한 것으로 보고 있다. 배터리 부문 분할이 확정되자 주주 가치 희석을 우려한 개인 투자자들이 실망 매물을 내놓고 있는 것에 주가가 영향을 받고 있다는 분석이다.,https://news.naver.com/main/read.nhn?mode=LS2D&mid=shm&sid1=101&sid2=258&oid=011&aid=0003819408
