20201120 오후 9:13,101,261,中·日 따돌린 LG화학 테슬라 모델Y 배터리 납품한다,머니투데이 우경희 기자 LG화학 중국 난징 1공장 전경 사진 LG화학LG화학이 내년부터 중국에서 생산되는 테슬라 전기차 SUV 스포츠다목적차량 모델Y 에 들어갈 전기차용 배터리를 수주한 것으로 전해졌다. LG화학은 테슬라 모델3 에 배터리를 공급한데 이어 신모델에까지 배터리를 납품하면서 전기차 세계 1위 테슬라와의 협력 관계를 보다 진전시킬 수 있게 됐다. 20일 배터리업계와 증권가 등에 따르면 LG화학은 최근 테슬라와 중국 상하이공장에서 내년부터 생산되는 모델Y 배터리 납품 계약을 체결한 것으로 알려졌다. LG화학은 이 계약 과정에서 중국 국영 배터리기업 CATL은 물론 테슬라와 오랜 밀월관계를 맺어 온 파나소닉과 경쟁한 것으로 전해졌다. 중국과 일본 라이벌들을 따돌리고 테슬라의 대규모 물량을 수주한 것이다. 모델Y는 보급형 전기차인 모델3 에 이어 테슬라가 상하이 공장에서 두 번째로 생산하는 제품이다. 지난 5일 중국 공업정보화부는 모델Y가 NCM 니켈·코발트·망간 배터리를 채택했다고 밝혔었다. LFP 리튬인산철 배터리를 주력으로 하는 중국 CATL NCA 니켈·코발트·알루미늄 배터리를 생산하는 파나소닉과 달리 LG화학만 테슬라에 NCM 배터리를 공급한다. 올해 초부터 상하이에서 모델3을 양산 중인 테슬라는 내년 초부터 모델Y를 양산해 중국 시장에 공급한다고 밝혔다. 올 들어 9월까지 중국산 모델3의 판매량은 8만500대에 달했다. 중국 톈펑 天風 증권은 내년 중국산 모델Y 판매량만 36만대에 달할 것으로 전망했다.배터리업계는 모델Y에 LG화학이 배터리를 공급하게 되면 LG화학이 파나소닉 등을 제치고 테슬라의 최대 배터리 공급업체 지위를 확보할 수 있다고 본다. 테슬라와 LG화학의 관계는 더 밀접해질 것으로 보인다. 미국 테슬라 전문매체 테슬라라티 는 LG화학의 차세대 원통형 배터리 형태가 테슬라의 차세대 배터리와 유사하다 고 보도했다. 한편 LG화학 측은 테슬라 모델Y 납품 여부에 대해 고객사 관련 사항은 확인해줄 수 없다 고 밝혔다.,https://news.naver.com/main/read.nhn?mode=LS2D&mid=shm&sid1=101&sid2=261&oid=008&aid=0004502867
20201120 오후 9:06,101,261,LG화학 中 생산 테슬라 모델Y 배터리 전량 공급,中 CATL 日 파나소닉 제치고 수주 NCM 배터리 기술력 인정 평가한중일 전기차 배터리 경쟁서 우위LG화학 중국 난징 배터리공장. 사진제공 LG화학 서울경제 LG화학이 내년부터 중국에서 생산되는 테슬라의 전기자동차 ‘모델Y’의 배터리를 전량 공급한다. 중국 정부의 보조금을 등에 업은 현지 업체인 CATL과 테슬라와 전략적 협력 관계인 일본 파나소닉을 제친 성과로 평가된다.20일 업계에 따르면 LG화학은 최근 미국 전기차 업체인 테슬라와 내년부터 중국 상하이 공장에서 생산되는 프리미엄 스포츠유틸리티차량 SUV 모델Y의 배터리를 공급하는 계약을 체결했다. 테슬라는 현재 미국 캘리포니아주 프리몬트 공장에서 모델Y를 생산하고 있고 내년부터는 중국 상하이 공장에서도 생산한다. 미국 공장에서 생산되는 모델Y에는 파나소닉의 배터리가 장착된다. LG화학 측은 모델Y 배터리 공급과 관련해 “고객사 계약과 관련된 내용은 확인해줄 수 없다”고 밝혔다. 중국에서 생산될 모델Y에는 LG화학이 난징공장에서 생산하는 원통형 NCM 니켈·코발트·망간 배터리가 공급될 것으로 알려졌다. 이는 중국 CATL이 테슬라 모델3에 공급하는 LFP 리튬·철·인산 배터리에 비해 에너지 밀도가 높아 주행 가능 거리가 늘고 무게는 줄어 효율이 높다. LG화학은 현재 테슬라가 중국에서 생산하는 전기차인 모델3에 NCM배터리를 공급하고 있다. 중국 현지에서는 테슬라 모델Y의 판매량이 36만대에 이를 것이라는 전망이 나왔다. 업계의 한 관계자는 “글로벌 전기차 시장을 주도하고 있는 테슬라가 LG화학의 배터리 기술력을 인정한 것”이라고 평가했다. LG화학이 한중일 배터리 경쟁에서 다시 한 번 기술력 우위를 확인하며 테슬라와의 협력도 한층 강화될 것이라는 관측이 나온다. 특히 유럽·미국 등과 함께 3대 글로벌 전기차 시장으로 꼽히는 중국에서의 수주여서 향후 현지 시장에서의 지배력 확대에 유리하게 작용할 것으로 보인다. 시장조사기관인 SNE리서치에 따르면 올해 9월 말 기준 글로벌 전기차배터리 시장 점유율 1위는 LG화학 24.6% 이지만 2·3위 업체인 CATL 23.7% 파나소닉 19.5% 과 큰 차이가 없다.,https://news.naver.com/main/read.nhn?mode=LS2D&mid=shm&sid1=101&sid2=261&oid=011&aid=0003829486
20201120 오후 8:23,101,261,LG화학 테슬라 모델Y에 배터리 공급,테슬라가 내년 중국 시장에서 선보이는 신형 스포츠유틸리티차량 SUV 모델Y에 LG화학 배터리를 탑재한다. LG화학 배터리가 테슬라에 탑재되는 것은 모델3에 이어 두 번째다.20일 외신에 따르면 LG화학은 테슬라와 내년 초 중국 상하이 기가팩토리에서 생산되는 신형 SUV 모델Y에 전기차 배터리를 납품하는 계약을 맺은 것으로 알려졌다. LG화학은 고객사와 관련된 내용은 확인할 수 없다 는 입장이지만 업계는 LG화학의 21700 지름 21㎜ 높이 70㎜ 배터리가 탑재될 것으로 보고 있다. 업계 관계자는 CATL은 리튬인산철 LFP 배터리를 모델3에 공급하고 있는데 LG화학의 21700 배터리 성능이 더 뛰어나다 며 모델3에서도 성능 중시형 모델에는 LG화학 배터리를 탑재하고 있다 고 말했다. 배터리 업계에서는 모델Y에 LG화학 배터리가 탑재되면서 향후 글로벌 전기차 배터리 시장에서 LG화학의 점유율이 크게 확대될 것으로 기대하고 있다.,https://news.naver.com/main/read.nhn?mode=LS2D&mid=shm&sid1=101&sid2=261&oid=009&aid=0004700311
20201120 오후 9:13,101,261,LG화학 내년 中테슬라 모델Y 배터리 전량 수주,파이낸셜뉴스 LG화학이 중국 CATL과 일본 파나소닉 등을 제치고 내년 중국에서 생산되는 테슬라의 전기자동차 모델Y에 들어갈 배터리를 전량 수주했다. 20일 관련업계에 따르면 LG화학은 최근 테슬라와 내년 초부터 중국 상하이 공장에서 생산하는 모델Y의 배터리를 납품하는 계약을 체결했다. 스포츠유틸리티차량 SUV 인 모델Y는 보급형 전기차인 모델3에 이어 테슬라가 중국 상하이 공장에서 2번째로 생산하는 제품이다. 모델Y엔 중국 난징의 LG화학 공장에서 생산하는 원통형 NCM 배터리가 장착될 것으로 전해졌다. 그동안 모델Y 배터리를 LG화학 CATL 파나소닉이 나눠서 수주할 것이라는 전망이 제기돼왔지만 LG화학이 전량을 공급하게 됐다는 설명이다. 배터리업계 관계자는 CATL의 주력인 LFP 리튬 철 인산 배터리로는 고급형 차량인 모델Y의 무게와 성능을 감당하기 어렵다 며 LG화학과 CATL의 기술력 격차가 다시 한번 증명된 것 이라고 설명했다. 이번 수주로 세계 최대 전기차 시장인 중국에서 LG화학의 점유율이 크게 상승할 것으로 예상되고 있다. 이와 관련 중국 톈펑증권은 테슬라의 내년 중국 시장 판매량은 올해보다 76% 많은 88만대로 예상된다 며 이 중 모델Y 판매량은 36만대에 이를 것 으로 전망했다.,https://news.naver.com/main/read.nhn?mode=LS2D&mid=shm&sid1=101&sid2=261&oid=014&aid=0004532688
20201120 오후 7:17,101,261,LG화학 중국 생산 테슬라 SUV 모델Y 배터리 전량 수주,LG화학이 내년부터 중국에서 생산되는 테슬라의 전기차 모델Y 에 들어갈 배터리를 전량 수주했다. 경쟁사인 중국 CATL과 일본 파나소닉을 제치고 배터리를 납품하게 된 것이다.20일 배터리 업계에 따르면 LG화학은 최근 테슬라와 중국 상하이 공장에서 내년 초부터 생산하는 스포츠유틸리티차량 SUV 인 모델Y의 배터리를 납품하는 계약을 맺었다. 모델Y는 보급형 전기차인 모델3 에 이어 테슬라가 상하이 공장에서 두 번째로 생산하는 제품이다. 테슬라 모델Y 테슬라테슬라는 모델Y에 탑재할 배터리로 LG화학의 NCM 니켈·코발트·망간 배터리를 선택했다. 앞서 지난 5일 중국 공업정보화부는 중국에서 생산하는 테슬라 모델Y가 NCM 배터리를 채택했다고 밝힌 바 있다.LFP 리튬인산철 배터리를 주력으로 하는 중국 CATL NCA 니켈·코발트·알루미늄 배터리를 생산하는 파나소닉과 달리 LG화학만 테슬라에 NCM 배터리를 공급한다. 모델Y의 경우 LG화학 CATL 파나소닉이 나눠서 수주할 것이란 업계 관측과 달리 LG화학이 전량 공급하는 것으로 나타났다.올해 초부터 상하이에서 모델3을 양산 중인 테슬라는 내년 초부터 모델Y를 양산해 중국 시장에 공급한다는 목표를 제시한 바 있다.올해 1 9월 중국산 모델3의 판매량은 8만500대에 달했다. 중국 톈펑 天風 증권은 내년 중국산 모델Y 판매량만 36만대에 달할 것으로 전망했다.LG화학 051910 관계자는 고객사 관련 사항은 확인해줄 수 없다 고 말했다.,https://news.naver.com/main/read.nhn?mode=LS2D&mid=shm&sid1=101&sid2=261&oid=366&aid=0000623115
20201120 오후 5:38,101,261,단독 LG화학 中서 테슬라 배터리 싹쓸이,모델Y 탑재 물량 전량 수주내년부터 年 3조원대 공급中 CATL·日 파나소닉 제쳐기술력 격차 다시 한번 증명LG화학이 내년 중국에서 생산되는 테슬라의 전기자동차 모델Y에 들어갈 배터리를 전량 수주했다. 강력한 경쟁 상대로 꼽히던 중국 CATL과 일본 파나소닉을 제쳤다. 한·중·일 3국 간 ‘배터리 전쟁’에서 한국이 다시 한번 승기를 잡았다는 평가가 나온다. 20일 업계에 따르면 LG화학은 최근 미국 전기차회사 테슬라와 내년 초부터 중국 상하이 공장에서 생산하는 모델Y의 배터리를 납품하는 계약을 맺었다. 스포츠유틸리티차량 SUV 인 모델Y는 보급형 전기차인 모델3에 이어 테슬라가 상하이 공장에서 두 번째로 생산하는 제품이다. 모델Y엔 중국 난징의 LG화학 공장에서 생산하는 원통형 NCM 니켈 코발트 망간 배터리가 장착될 것으로 알려졌다.테슬라 전기차에 LG화학의 배터리가 사용되는 건 중국산 모델3에 이어 두 번째다. 현재 저가형 모델3에는 중국 CATL이 고급형 모델3에는 LG화학이 배터리를 공급하고 있다.그동안 업계에선 모델Y 배터리를 LG화학 CATL 파나소닉이 나눠서 수주할 것이란 관측이 나왔지만 LG화학이 전량 공급하는 것으로 결론났다. 배터리업계 관계자는 “CATL의 주력인 LFP 리튬 철 인산 배터리로는 고급형 차량인 모델Y의 무게와 성능을 감당하기 어렵다”며 “LG화학과 CATL의 기술력 격차가 다시 한번 증명된 것”이라고 설명했다.이번 수주로 세계 최대 전기차 시장인 중국에서 LG화학의 점유율이 크게 상승할 전망이다. 중국 톈펑증권은 “테슬라의 내년 중국 시장 판매량이 올해보다 76% 많은 88만 대로 예상된다”며 “이 중 모델Y 판매량은 36만 대에 이를 것”으로 전망했다.두 회사는 구체적인 계약 규모는 밝히지 않았다. 내년 예상 판매량을 기준으로 추산하면 LG화학의 모델Y 배터리 수주액 규모는 최소 연 3조원에 이를 전망이다.,https://news.naver.com/main/read.nhn?mode=LS2D&mid=shm&sid1=101&sid2=261&oid=015&aid=0004453538
20201120 오후 5:20,101,261,중국 기업인 격리 면제 중단 직전…가까스로 뜬 LG화학 전세기,LG화학 배터리 엔지니어 등 100명 출국중국이 신종 코로나바이러스 감염증 코로나19 재확산을 이유로 외국 기업인 입국 시 격리를 면제하는 신속통로 제도 패스트트랙 를 잠정 중단한 가운데 LG화학 직원들을 태운 전세기가 20일 중국으로 출국했다. 사진은 인천국제공항 출국장에서 이용객들이 코로나19 음성확인서를 지참하고 수속 절차를 밟는 모습. 한국일보 자료사진중국이 신종 코로나바이러스 감염증 코로나19 재확산을 이유로 외국 기업인 입국 시 격리를 면제하는 신속통로 제도 패스트트랙 를 잠정 중단한 가운데 LG화학 직원들을 태운 전세기가 20일 중국으로 출국했다. LG화학 전세기는 중국 정부가 패스트트랙 금지 입장을 밝히기 전 중국 입국을 신청해 허가받은 것으로 알려졌다.LG화학은 자사 배터리 분야 엔지니어 등 직원 100여 명을 태운 전세기가 인천공항을 통해 중국 난징으로 떠났다고 20일 밝혔다.난징에는 LG화학의 전기차 배터리 공장이 있다. LG화학은 공장 운영을 위해 입국 시 격리를 면제해주는 기업인 패스트트랙 제도를 이용해 출국했다.배터리 업계에 따르면 최근 중국 정부는 LG화학에 추가적인 전세기 입국 신청을 받지 않겠다 는 입장을 전했다. 그러나 이날 출국한 LG화학 전세기는 중국 정부가 이 같은 방침을 밝히기 전 중국 입국을 신청해 허가받은 것으로 알려졌다.앞서 삼성전자와 협력사 직원들을 태우고 지난 13일 중국으로 출국할 예정이었던 전세기 2편은 중국 정부의 입국 불허로 취소됐다. 이를 두고 업계에서는 중국 정부가 코로나19 재확산에 따라 패스트트랙을 중단하는 것이 아니냐는 우려가 나왔지만 한중 정부는 기존과 변함 없이 운영한다고 밝혔다.싱하이밍 주한 중국대사는 전날인 19일 2020 한중 우호 청년포럼 에 참석해 패스트트랙이 힘들다는데 그것은 사실이 아니다 며 패스트트랙은 계속하고 방역은 방역대로 계속할 것 이라고 말했다.,https://news.naver.com/main/read.nhn?mode=LS2D&mid=shm&sid1=101&sid2=261&oid=469&aid=0000555732
20201120 오후 5:24,101,261,단독 LG화학 중국 생산 테슬라 모델Y 배터리 전량 수주,최만수의 전기차 배터리 인사이드中CATL 日파나소닉 등 경쟁자 제쳐한중일 배터리 삼국지서 승기 머스크 야심작 프리미엄 SUV에 장착테슬라 모델YLG화학이 내년 중국에서 생산되는 테슬라의 전기자동차 모델Y에 들어갈 배터리를 전량 수주했다. 강력한 경쟁 상대로 꼽히던 중국 CATL과 일본 파나소닉을 제쳤다. 한·중·일 3국 간 ‘배터리 전쟁’에서 한국이 다시 한번 승기를 잡았다는 평가가 나온다. 기술력 격차 다시 한번 증명20일 업계에 따르면 LG화학은 최근 미국 전기차회사 테슬라와 내년 초부터 중국 상하이 공장에서 생산하는 모델Y의 배터리를 납품하는 계약을 맺었다. 머스크의 야심작 으로 불리는 스포츠유틸리티차량 SUV 모델Y는 보급형 전기차인 모델3에 이어 테슬라가 상하이 공장에서 두 번째로 생산하는 제품이다. 모델Y엔 중국 난징의 LG화학 공장에서 생산하는 원통형 NCM 니켈 코발트 망간 배터리가 장착될 것으로 알려졌다.테슬라 전기차에 LG화학의 배터리가 사용되는 건 중국산 모델3에 이어 두 번째다. 현재 저가형 모델3에는 중국 CATL이 고급형 모델3에는 LG화학이 배터리를 공급하고 있다. 그동안 업계에선 모델Y 배터리를 LG화학 CATL 파나소닉이 나눠서 수주할 것이란 관측이 나왔지만 LG화학이 전량 공급하는 것으로 결론났다. 배터리업계 관계자는 “CATL의 주력인 LFP 리튬 철 인산 배터리로는 고급형 차량인 모델Y의 무게와 성능을 감당하기 어렵다”며 “LG화학과 CATL의 기술력 격차가 다시 한번 증명된 것”이라고 설명했다. 이번 수주로 세계 최대 전기차 시장인 중국에서 LG화학의 점유율이 크게 상승할 전망이다. 중국 톈펑증권은 “테슬라의 내년 중국 시장 판매량이 올해보다 76% 많은 88만 대로 예상된다”며 “이 중 모델Y 판매량은 36만 대에 이를 것”으로 전망했다.두 회사는 구체적인 계약 규모는 밝히지 않았다. 내년 예상 판매량을 기준으로 추산하면 LG화학의 모델Y 배터리 수주액 규모는 최소 연 3조원에 이를 전망이다.테슬라 모델3 가격보다 성능 택한 테슬라테슬라는 최근 공식웹사이트를 통해 모델Y 롱레인지 모델 과 퍼포먼스 모델 의 예약을 받기 시작했다. 가격은 48만8000위안 53만5000위안 약 8200만원 9100만원 으로 예상된다. 모델Y는 테슬라의 첫 SUV모델이다. 미국 캘리포니아 프리몬트 공장에서 지난 1분기부터 양산에 돌입했으며 내년 1분기부터는 중국 상하이 기가팩토리에서도 생산을 시작한다. 테슬라가 모델Y에 탑재할 배터리를 LG화학 제품으로 결정한 것은 성능을 중시한 결과라는 분석이 나온다. 모델Y는 공차중량이 약 2t으로 모델3 약 1.6t 보다 25% 무겁다. 가격은 상대적으로 저렴한데 반해 에너지밀도가 낮아 출력과 항속거리가 떨어지는 CATL의 LFP 리튬·철·인산 배터리로는 감당하기가 쉽지 않다는 평가가 많다. 테슬라가 모델3보다 약 1.5배 비싼 모델Y의 품질 확보를 위해 성능이 앞선 ‘LG배터리’를 선택했다는 의미다. 배터리 업계 관계자는 LG화학은 고급형 모델3에 납품하며 테슬라와 신뢰 관계를 쌓았다 며 상하이와 가까운 중국 난징에 공장이 있는 만큼 물량을 문제없이 공급할 수 있을 것 이라고 말했다. CATL도 LG화학처럼 NCM 니켈·코발트·망간 배터리를 일부 생산하고 있다. 하지만 기술력 격차가 아직 상당하다는 게 업계 분석이다. 중국의 언론 통제로 제대로 공개되지 않고 있지만 최근 CATL의 NCM 배터리를 탑재한 차량에서 잇따라 화재사고가 발생한 것으로 알려졌다. 세계 1위 굳히기 나선 LG화학중국 배터리 업계는 충격에 빠졌다. 중국 정부가 자국 기업이 생산한 배터리를 탑재한 전기차에만 보조금을 지급하는 배타적인 정책까지 써가며 지원에 나섰지만 LG화학의 기술력에 밀렸기 때문이다.이번 수주로 내년 LG화학의 중국 내 점유율이 상당히 높아질 것으로 예상된다. 중국 전기차 배터리 시장에선 CATL 올해 상반기 기준 48.3% 과 BYD 14.0% 가 압도적인 점유율을 차지하고 있다. 작년말부터 중국산 테슬라 모델3에 배터리를 납품하고 하고 있는 LG화학은 9.5%의 점유율로 3위다. 여기에 모델Y 납품물량이 추가되면 BYD를 제치고 CATL에 이어 중국 시장 2위로 뛰어오를 수 있다. 상대적으로 열세였던 세계 최대 전기차 시장 중국에서 LG화학이 점유율을 늘리면 ‘세계 1위’라는 위상도 더욱 견고해질 전망이다. 시장조사업체 SNE리서치에 따르면 올해 9월말 기준 LG화학의 세계 전기차 배터리 시장 점유율은 24.6%로 CALT 23.7% 파나소닉 19.5% 과 치열한 선두 다툼을 펼치고 있다.테슬라 전기차 배터리의 추가 수주도 기대된다. 일론 머스크 테슬라 최고경영자 CEO 는 지난 9월 ‘배터리데이’에서 니켈 양극재 함량을 높인 ‘하이니켈 배터리’를 주력으로 삼겠다고 밝혔다. LG화학은 하이니켈 배터리 개발에서 가장 앞서 있는 기업으로 꼽힌다. LG화학은 올해 약 13조원으로 추정되는 배터리 매출을 2024년 30조원까지 늘린다는 목표다. 배터리 생산능력도 올해말 100GW 기가와트 에서 2023년 260GW 이상으로 확대하기로 했다. LG화학 관계자는 “미국 중국 유럽 3개 지역에 모두 생산거점을 구축한 세계에서 유일한 업체”라며 “앞선 기술력으로 글로벌 시장을 선점하겠다”고 말했다.,https://news.naver.com/main/read.nhn?mode=LS2D&mid=shm&sid1=101&sid2=261&oid=015&aid=0004453492
